575,Autobiography of God: Discover the Extravagant Love of God,Lloyd John Ogilvie, , ,Baker Publishing Group,9781441224279,07/22/2013,256, ,"686,614",1,2.0,$10.49, ,$10.49, 
576,The Autobiography of a Super-Tramp,W.H. Davies, , ,Waxkeep Publishing,9781508006497,02/21/2015, , ,"688,179", , ,$15.00,$27.95,$0.99, 
577,Valleywood: The Autobiography of Lateysha Grace,Lateysha Grace, , ,"John Blake Publishing, Limited",9781784183516,06/01/2015,240, ,"688,467", , , ,$22.15,$10.49, 
578,Up From Slavery: An Autobiography of Booker T. Washington,Booker T. Washington, , ,Bronson Tweed Publishing,2940148325369,02/08/2014, , ,"689,485", , , , , , 
579,Totally Frank: The Autobiography of Frank Lampard,Frank Lampard, , ,HarperCollins Publishers,9780007382217,04/29/2010,480, ,"689,634",3,4.0, ,$9.99,$9.99, 
580,Steve Jobs Bio: The Unauthorized Autobiography,J.T. Owens, , ,J.T. Owens,2940046205206,09/28/2014, , ,"690,278",3,5.0, , , , 
581,Running: The Autobiography,Ronnie O'Sullivan, , ,"Orion Publishing Group, Limited",9781409112242,10/10/2013, , ,"691,205", , ,$15.91, ,$5.99, 
582,The Autobiography of God: A Novel,Julius Lester, , ,St. Martin's Press,9781429937405,12/27/2005,256, ,"691,879",2,4.5,$16.40, ,$7.99, 
583,Born to Rebel: An Autobiography,Benjamin Mays, , ,University of Georgia Press,9780820325231,04/14/2003,466,6.00(w) x 9.00(h) x 1.20(d),"693,967",1,5.0,$25.03, , , 
584,Autobiography of a Schizophrenic Girl: The True Story of Renee,Marguerite Sechehaye, , ,Penguin Publishing Group,9780452011335,11/28/1994,192,5.08(w) x 6.96(h) x 0.51(d),"695,873", , ,$13.58, , , 
585,Joey the Hitman: The Autobiography of a Mafia Killer,David Fisher, , ,Da Capo Press,9781560253938,03/28/2002,288,6.00(w) x 9.00(h) x 0.75(d),"699,739", , , , , , 
586,Autobiography of a Spiritually Incorrect Mystic,Osho, , ,St. Martin's Press,9780312280710,06/28/2001,336,6.12(w) x 9.14(h) x 0.93(d),"700,664",7,4.1,$11.80, ,$9.99, 
587,Cesar Chavez: Autobiography of La Causa,Jacques E. Levy, , ,University of Minnesota Press,9780816650491,08/17/2007,600,6.00(w) x 9.00(h) x 1.70(d),"701,322", , ,$17.06, ,$11.99, 
588,When You Get There: An Autobiography,Jennifer Carroll, , ,Advantage Media Group,9781599324999,09/28/2014,174,8.80(w) x 5.90(h) x 0.40(d),"705,353",1,5.0, , , , 
589,The Autobiography of a Flea,Stanislas de Rhodes, , ,HarperCollins UK,9780007300457,01/19/2009,192,4.40(w) x 6.90(h) x 0.60(d),"705,959", , ,$8.99, ,$5.99, 
590,Mandela: An Illustrated Autobiography,Nelson Mandela, , ,"Little, Brown and Company",9780316550383,11/01/1996,208,9.25(w) x 10.15(h) x 0.72(d),"709,428",1,5.0, ,$21.25, , 
591,The Autobiography of My Mother: A Novel,Jamaica Kincaid, , ,"Farrar, Straus and Giroux",9780374531874,05/07/2013,240,5.40(w) x 8.10(h) x 0.70(d),"709,442",5,2.8,$10.22, ,$9.94, 
592,King of the Wild Frontier: An Autobiography,Davy Crockett, , ,Dover Publications,9780486476919,06/17/2010,128,5.30(w) x 8.40(h) x 0.30(d),"711,278", , ,$6.95, ,$5.49, 
593,Down the Crooked Road: My Autobiography,Mary Black, , ,Transworld Publishers Limited,9781848271883,08/01/2015,320,5.00(w) x 7.70(h) x 1.00(d),"712,324", , ,$18.95,$34.26,$10.49, 
594,Glenn Hughes The Autobiography: From Deep Purple to Black Country Communion,Glenn Hughes, , ,"Outline Press, Limited",9781906002923,11/01/2011,256,5.90(w) x 8.40(h) x 1.00(d),"713,014",2,4.0, , , , 
595,Hiding My Candy: The Autobiography of the Grand Empress of Savannah,The lady Chablis,The Lady Chablis,Theodore Bouloukos,Atria Books,9780671520953,08/28/1997,208,5.60(w) x 9.10(h) x 0.50(d),"713,096",2,4.0,$13.46, , , 
596,Twice Pardoned: Autobiography,Richard E Morris, , ,King Richard Edward,9780692214497,05/02/2014,104,6.00(w) x 9.00(h) x 0.22(d),"714,740", , , , , , 
597,African Rhythms: The Autobiography of Randy Weston,Randy Weston,Willard Jenkins, ,Duke University Press Books,9780822347989,02/19/2015,352,6.00(w) x 8.90(h) x 0.80(d),"715,219", , ,$22.70,$30.13,$13.99, 
598,Treat It Gentle: An Autobiography,Sidney Bechet, , ,Da Capo Press,9780306811081,03/05/2002,276,5.52(w) x 8.50(h) x 0.91(d),"717,801", , ,$12.57, , , 
599,Autobiography of a Sadhu: A Journey into Mystic India,Rampuri, , ,Inner Traditions/Bear &amp; Company,9781594773303,03/28/2010,256,6.00(w) x 9.20(h) x 0.70(d),"718,080", , ,$15.55, ,$10.49, 
600,Andrew Wyeth: Autobiography,Andrew Wyeth, , ,Bulfinch,9780821225691,09/15/1998,168,10.00(w) x 11.00(h) x 0.50(d),"718,452", , ,$19.86, , , 
601,"Mountain Wolf Woman, Sister of Crashing Thunder: The Autobiography of a Winnebago Indian / Edition 1",Nancy Oestreich Lurie,Mountain, ,University of Michigan Press,9780472061099,06/01/1961,176,5.00(w) x 8.00(h) x 0.40(d),"719,883", , ,$15.15, , , 
602,The River of No Return: The Autobiography of a Black Militant and the Life and Death of SNCC / Edition 1,Cleveland Sellers, , ,University Press of Mississippi,9780878054749,10/01/1990,296,5.50(w) x 8.50(h) x 0.67(d),"720,100", , ,$21.27, , , 
603,Buffalo Bill's Life Story: An Autobiography,Buffalo Bill Cody, , ,Skyhorse Publishing,9781602397521,04/01/2010,368,5.50(w) x 8.20(h) x 1.40(d),"720,844",1,2.0,$12.95, ,$10.49, 
604,"It Is What It Is: The Autobiography of Gerald H. Duffy, Jr",Gerald Duffy, , ,CreateSpace Publishing,9781467965323,04/11/2012,298,6.00(w) x 9.00(h) x 0.67(d),"721,337", , , , , , 
605,"Autobiography Of Calvin Coolidge, The",Calvin Coolidge, , ,Press Holdings International,9781410216229,09/13/2004,272,5.00(w) x 8.00(h) x 0.61(d),"721,511", , ,$27.50, , , 
606,Autobiography of Ma-ka-tai-me-she-kia-kiak or Black Hawk,Black Hawk, , ,CreateSpace Publishing,9781515035145,07/11/2015,146,6.00(w) x 9.00(h) x 0.31(d),"721,863", , ,$6.99, ,$0.99, 
607,"Autobiography of Thomas Jefferson, 1743-1790, Together With a Summary of the Chief Events in Jefferson's Life (Classic Reprint)",Thomas Jefferson, , ,FB &amp;c Ltd,9781440086007,06/25/2015,224,6.00(w) x 9.00(h) x 0.47(d),"721,990", , ,$18.20, ,$0.00, 
608,"I, Toto: The Autobiography of Terry, the Dog Who Was Toto",Willard Carroll, , ,Abrams Image,9781419709838,09/17/2013,96,6.60(w) x 8.40(h) x 0.60(d),"722,656",6,5.0, ,$15.35, , 
609,Without Stopping: An Autobiography,Paul Bowles, , ,HarperCollins Publishers,9780061137419,10/31/2006,400,5.50(w) x 8.25(h) x 1.00(d),"723,030", , ,$10.88, , , 
610,Monodies and On the Relics of Saints: The Autobiography and a Manifesto of a French Monk from the Time of the Crusades,Guibert of Nogent, , ,Penguin Publishing Group,9780143106302,09/27/2011,400,5.00(w) x 7.70(h) x 0.80(d),"723,370", , ,$14.71, ,$16.99, 
611,Intrepid Explorer: The Autobiography of the World's Best Mine Finder,J. David Lowell, , ,Sentinel Peak Books,9781941451007,10/03/2014,496,6.25(w) x 9.25(h) x 1.50(d),"723,773", , ,$24.95,$26.69,$19.99, 
612,The House That Jack Built: The Autobiography of a Successful American Dreamer Businessman and Entertainer: the Autobiography of a Successful American Dreamer Businessman and Entertainer,Hal Jackson,James Haskins, ,"Amber Communications Group, Inc.",9780972751940,06/28/2003,230,6.00(w) x 9.00(h) x 0.48(d),"723,836", , ,$16.95, , , 
613,"Reading Jazz: A Gathering of Autobiography, Reportage, and Criticism from 1919 to Now",Robert Gottlieb, , ,Knopf Doubleday Publishing Group,9780679781110,10/28/1999,1088,5.10(w) x 8.00(h) x 1.80(d),"724,846", , ,$20.63, ,$15.99, 
614,An Autobiography of Anthony Trollope,Anthony Trollope, , ,CreateSpace Publishing,9781503261020,02/09/2015,230,6.00(w) x 9.00(h) x 0.48(d),"725,235",1,4.0,$9.99,$33.99,$3.99, 
615,Hound Dog: The Leiber and Stoller Autobiography,Jerry Leiber,Mike Stoller, ,Simon &amp; Schuster,9781416559399,06/01/2010,336,9.26(w) x 6.26(h) x 0.85(d),"725,762",19,3.3,$12.68, ,$12.99, 
616,The Wheel of Fortune: The Official Autobiography,Edith Piaf, , ,"Owen, Peter Limited",9780720612288,02/09/2005,192,5.00(w) x 8.00(h) x 0.40(d),"726,374",1,5.0, , , , 
617,Growing Where I Was Planted: Autobiography,Margaret L. Kryder Warren Founder of Island Poultry Farm,Inc., ,"Outskirts Press, Inc.",9781478734536,02/04/2015,280,6.00(w) x 9.00(h) x 0.59(d),"728,630", , ,$12.95,$22.95, , 
618,Bruno Sammartino: an Autobiography of Wrestling's Living Legend,Bob Michelucci,Paul McCollough, ,CreateSpace Publishing,9781440476983,11/29/2008,276,6.00(w) x 9.00(h) x 0.58(d),"728,648", , , , , , 
619,Spiritual Autobiography: Discovering and Sharing Your Spiritual Story,Richard Peace, , ,Tyndale House Publishers,9781576831106,12/01/1998,112,5.54(w) x 8.52(h) x 0.28(d),"729,852", , , , , , 
620,Autobiography,Marcel Van, , ,Gracewing Publishing,9780852445976,03/01/2006,396,0.81(w) x 6.14(h) x 9.21(d),"730,534", , , , , , 
621,Illumination and Night Glare: The Unfinished Autobiography of Carson McCullers (Wisconsin Studies in Autobiography Series),Carson McCullers, , ,University of Wisconsin Press,9780299164447,12/28/2001,231,6.00(w) x 9.00(h) x 0.90(d),"731,647", , ,$16.63, , , 
622,J. Hudson Taylor: An Autobiography,J. Hudson Taylor, , ,ReadaClassic.com,9781611043303,12/28/2010,106,6.00(w) x 9.00(h) x 0.22(d),"733,393", , ,$6.95, , , 
623,Autobiography,Benvenuto Cellini, , ,Penguin Publishing Group,9780140447187,11/28/1999,496,5.05(w) x 7.74(h) x 0.85(d),"735,110", , ,$13.80, , , 
624,Nation of Lords: The Autobiography of the Vice Lords / Edition 2,David Dawley, , ,"Waveland Press, Inc.",9780881336283,03/01/1992,224,6.00(w) x 9.00(h) x (d),"736,755",1,3.0,$19.29, , , 
625,Africa in My Blood: An Autobiography in Letters: The Early Years,Jane Goodall, , ,Houghton Mifflin Harcourt,9780618127351,04/28/2001,416,6.00(w) x 9.00(h) x 1.09(d),"737,571", , ,$12.64, , , 
626,Porn King - The Autobiography of John Holmes,John Holmes, , ,BearManor Media,9781593936853,01/31/2012,172,6.00(w) x 9.00(h) x 0.37(d),"738,502", , , , , , 
627,"History: Best Seller! The Great War ( autobiography, diary, journal, life, life story, memoir, picture, profile, sketch, confessions, experience, letter, life history, personal account )",History Books,World War,History,Resounding Wind Publishing,2940149993321,12/16/2014, , ,"741,243",1,5.0, , , , 
628,Franklin's Autobiography [Illustrated],Benjamin Franklin, , ,"Five Star Publishing, LLC",2940012753205,07/18/2011,144, ,"741,682",2,5.0,$15.95,$25.95,$0.99, 
629,Telling the Stories of Life through Guided Autobiography Groups / Edition 1,James E. Birren,Kathryn N. Cochran, ,Johns Hopkins University Press,9780801866340,06/07/2001,208,6.00(w) x 9.00(h) x 0.55(d),"741,717", , , , , , 
630,An Autobiography of a Man with a Psychiatric Disorder,Surya, , ,Partridge Publishing India,9781482840728,10/29/2014,72, ,"741,851", , ,$6.99, ,$4.49, 
631,Reading Jackie: Her Autobiography in Books,William Kuhn, , ,Knopf Doubleday Publishing Group,9780385531009,12/07/2010,368, ,"742,430", , ,$11.50,$27.95,$11.99, 
632,Lay Bare the Heart: An Autobiography of the Civil Rights Movement,James Farmer, , ,Texas Christian University Press,9780875655208,05/31/2013,370, ,"745,334", , ,$18.18, ,$10.99, 
633,X-Ray: The Unauthorized Autobiography,Ray Davies, , ,The Overlook Press,9781468302387,10/30/2007,432, ,"747,291", , ,$14.61, ,$10.49, 
634,DB Cooper Where Are You: My Own Story. A Fictionalized Autobiography,Walter Grant, , ,Publication Consultants,9781594331480,07/01/2008,160, ,"747,457",2,5.0, , , , 
635,The Last Maasai Warriors: An Autobiography,Jackson Ntirkana,Wilson Meikuaya, ,Greystone Books,9781927435014,08/24/2012,224, ,"748,686", , ,$10.99, ,$10.99, 
636,The Autobiography of Miss Jane Pittman (SparkNotes Literature Guide),SparkNotes,Ernest J. Gaines, ,Spark,9781411474048,08/12/2014,80, ,"750,384",5,4.0, , , , 
637,Autobiography of Ma-Ka-Tai-Me-She-Kia-Kiak or Black Hawk (1882),Black Hawk, , ,B&amp;R Samizdat Express,2940000785560,02/01/2009, , ,"752,481",4,5.0,$8.95, ,$0.99, 
638,Sab and Autobiography,Gertrudis Gómez de Avellaneda y Arteaga, , ,University of Texas Press,9780292792173,06/04/2010, , ,"752,666",2,5.0,$21.95, ,$8.99, 
639,A Kind Of Grace,Jacqueline Joyner-Kersee, , ,Grand Central Publishing,9780446522489,11/03/2001,344,6.10(w) x 9.10(h) x 1.10(d),"594,124",3,4.7, ,$28.00,$12.99, 
640,The Autobiography Of Benjamin Franklin; The Journal Of John Woolman; Fruits Of Solitude By William Penn,Charles W. Eliot,John Woolman, ,Cosimo,9781616400514,02/01/2010,422,5.50(w) x 8.50(h) x 0.94(d),"753,911", , ,$24.99,$34.99, , 
641,"Autobiography of a Good Life: Growing Up In West Virginia on a Hill Farm, Getting an Education, Traveling In a World Filled with Friends",Roger Lewis Lee, , ,Lulu.com,9781257532001,08/10/2011, , ,"755,534", , , , , , 
642,Outside the Magic Circle: The Autobiography of Virginia Foster Durr,Virginia Foster Durr, , ,University of Alabama Press,9780817387105,02/09/2013,384, ,"755,634", , , ,$19.99,$19.99, 
643,Geological Observations on South America,Charles Darwin, , ,MobileReference,9781605016467,01/01/2010, , ,"488,791", , ,$20.99, ,$0.95, 
644,London: the Autobiography,Jon E. Lewis, , ,"Little, Brown Book Group",9781780337500,03/01/2012,480, ,"759,718", , ,$15.95, ,$6.99, 
645,"The Story of a Soul: The Autobiography of St. Therese of Lisieux with Counsels, Reminicences, Letters, Prayers, and Poems of the Saint",Paul Boer,St. Therese of Lisieux, ,Veritatis Splendor Publications,2940149293377,05/07/2014,364, ,"762,579", , , , , , 
646,Time to Say Hello: My Autobiography,Katherine Jenkins, , ,"Orion Publishing Group, Limited",9781409129264,11/15/2012, , ,"762,927", , , , , , 
647,HOPEFUL - an autobiography,Omid Djalili, , ,"Headline Book Publishing, Limited",9781472218636,08/28/2014, , ,"764,201", , , , , , 
648,Blessed Be: An Autobiography and Christian Testimony,Julia Wells, , ,Xlibris US,9781462830688,11/16/2009,203, ,"766,045",2,4.5,$19.99,$26.99,$8.49, 
649,A Burlesque Autobiography,Mark Twain, , ,B&amp;R Samizdat Express,2940000737040,09/01/2009, , ,"768,152", , ,$4.95, ,$0.99, 
650,A Kind of Magic: An Autobiography,Edna Ferber, , ,Knopf Doubleday Publishing Group,9780345805805,03/04/2014,352, ,"768,761", , , , , , 
651,The Venusian Trilogy / From Venus I Came: Autobiography Part 1,Omnec Onec, , ,Das Gute Buch Verlagsanstalt,9783952121917,05/28/2014,182, ,"770,584", , , , , , 
652,"Complete Flavius Josephus Collection: Antiquities of the Jews, Autobiography of Josephus, An Extract Out Of Josephus's Discourse To The Greeks Concerning Hades, The Wars of the Jews",Flavius Josephus, , ,Unforgotten Classics,2940016536170,08/25/2015, , ,"771,461", , , , , , 
653,The Life Of Shabkar: Autobiography Of A Tibetan Yogin / Edition 1,Matthieu Ricard, , ,"Shambhala Publications, Inc.",9781559391542,02/28/2001,712,7.02(w) x 9.83(h) x 1.81(d),"773,097", , ,$35.71, ,$28.49, 
654,Ready Reference Treatise: The Autobiography of Miss Jane Pittman,Raja Sharma, , ,Raja Sharma,2940044257818,01/18/2013, , ,"774,926", , , , , , 
655,Honest: My Story So Far: The Official Autobiography,Tulisa Contostavlos, , ,"Headline Book Publishing, Limited",9780755363742,09/27/2012, , ,"775,180",1,5.0,$11.58, ,$6.99, 
656,Evolutionary Writings: Including the Autobiographies,Charles Darwin, , ,Oxford University Press,9780199580149,06/06/2010,544,5.10(w) x 7.60(h) x 1.10(d),"775,472", , ,$10.42,$19.96,$7.99, 
657,"My Life, as I See It: An Autobiography",Dionne Warwick,David Freeman Wooley, ,Atria Books,9781439171363,11/02/2010,304, ,"775,488",4,2.7,$19.99,$20.46,$13.99, 
658,The Complete Autobiographies of Frederick Douglass,Frederick Douglass, , ,Start Publishing LLC,9781627931687,05/20/2013,755, ,"775,529", , , ,$29.99,$1.99, 
659,The Big Sea: An Autobiography,Langston Hughes l Summary & Study Guide, , ,BookRags.com,2940012954480,06/09/2011, , ,"775,567", , , , , , 
660,The Autobiography of Benjamin Franklin (SparkNotes Literature Guide),SparkNotes,Benjamin Franklin, ,Spark,9781411474024,08/12/2014,80, ,"775,712",2,2.0, , , , 
661,Trapped in a Little Girl's Body: An Autobiography,Dorean Edwards, , ,CreateSpace Publishing,9781512316599,05/21/2015,156,6.00(w) x 9.00(h) x 0.33(d),"776,674", , , , , , 
662,Oil Paint and Grease Paint: The Autobiography of Laura Knight,Dame Laura Knight, , ,Unicorn Press Ltd,9781910065587,11/15/2015,256,6.00(w) x 8.00(h) x (d),"778,687", , , , , , 
663,Autobiography of Parley P Pratt,Parley P. Pratt, , ,Deseret Book Company,9781606412886,02/06/2012, , ,"781,615",2,5.0,$17.98, ,$11.49, 
664,Living High: An Unconventional Autobiography,June Burn, , ,San Juan Publishing,9780970739995,06/28/2011,292,5.50(w) x 7.90(h) x 0.90(d),"782,610", , , , , , 
665,The Autobiography of a Flea,Stanislas de Rhodes, , ,HarperCollins Canada,9781443426855,05/21/2013,176, ,"785,520", , , , ,$0.99, 
666,The Journey from Error to Heir: An autobiography of a life's journey from abuse to finding a victory of God's choosing--far bigger and different from what I thought victory could ever be,Earnie Lewis, , ,Inspiring Voices,9781462411399,07/28/2015,228, ,"787,580", , ,$16.99, ,$4.49, 
667,"Autobiographies: The Collected Works of W.B. Yeats, Volume III",William Butler Yeats, , ,Scribner,9781451603033,06/15/2010,560, ,"788,497",7,5.0, ,$19.99,$19.99, 
668,Story of a Soul The Autobiography of St. Therese of Lisieux: Third Edition Translated from the Original Manuscripts,St. Therese of Lisieux, , ,ICS Publications,2940148767985,09/21/2013,300, ,"789,100",1,5.0, , , , 
669,The The Autobiography of a Kiowa Apache Indian Autobiography of a Kiowa Apache Indian,Charles S. Brant, , ,Dover Publications,9780486148281,12/21/2012,160, ,"789,149",1,3.0,$4.99, ,$4.99, 
670,The Autobiography of an Ex-Colored Man,James Weldon Johnson, , ,Civitas Media LLC,2940148402671,09/10/2013, , ,"792,132", , , , , , 
671,Robert Vaughn: A Fortunate Life: An Autobiography,Robert Vaughn, , ,JR Books Ltd,9781907532535,02/18/2013,320, ,"792,152", , , , , , 
672,The Dingo's Got My Ba,: The autobiography of Lindy Chamberlain-Creighton, , ,Pan Macmillan Australia,9781743340288,03/10/2012, , ,"792,275", , , , , , 
673,Autobiography of Madame Guyon,Madame Guyon, , ,ReadHowYouWant,9781442937284,07/13/2009, , ,"796,690",2,2.5,$12.99,$32.99,$2.99, 
674,Autobiography of a Poodle,Con Slobodchikoff, , ,Argo-Navis,9780786754083,08/01/2012,135, ,"798,158", , , , , , 
675,The Fairy Tale of My Life: An Autobiography,Hans Christian Andersen,Naomi Lewis,a renowned Andersen scholar,"Rowman &amp; Littlefield Publishers, Inc.",9781461741695,09/25/2000,610, ,"799,450", , ,$24.13, ,$10.49, 
676,Toussaint L'Ouverture: A Biography and Autobiography,J.R. Beard, , ,Heraklion Press,9781629215679,09/27/2013, , ,"804,384", , ,$26.99,$27.95,$0.99, 
677,Pippa Funnell: The Autobiography,Pippa Funnell, , ,"Orion Publishing Group, Limited",9781409127420,08/16/2012, , ,"806,960", , ,$14.37, ,$6.99, 
678,"Scotland: An Autobiography: 2,000 Years of Scottish History",Those Who Saw It Happen, , ,The Overlook Press,9781468303124,12/29/2009,512, ,"808,888", , ,$10.99, ,$10.99, 
679,Hiroshima: The Autobiography of Barefoot Gen,Nakazawa Keiji,Richard H. Minear, ,"Rowman &amp; Littlefield Publishers, Inc.",9781442207493,11/16/2010,216, ,"810,341",1,5.0, ,$36.90,$25.99, 
680,Slaying the Cancer Giant with the Word of God: An Autobiography of a Cancer Survivor,Rev. Dr. Diana Fields, , ,WestBow Press,9781449760625,09/19/2012,160, ,"811,537", , ,$13.99,$30.99,$3.49, 
681,Guerilla Days In Ireland: Tom Barry's Autobiography,Tom Barry, , ,"Mercier Press, Limited, The",9781856357234,01/01/1981,242, ,"812,498", , ,$22.42, ,$8.49, 
682,"Flavius Josephus Collection: Antiquities of the Jews, Autobiography of Josephus, An Extract Out Of Josephus's Discourse To The Greeks Concerning Hades, The Wars of the Jews",Flavius Josephus, , ,Unforgotten Classics,2940016632377,08/03/2015, , ,"812,952", , , , , , 
683,Jade: Fighting to the End: My Autobiography 1981-2009,Jade Goody, , ,"John Blake Publishing, Limited",9781782192404,05/01/2009,282, ,"813,124", , ,$11.77, ,$8.49, 
684,A Journey to Waco: Autobiography of a Branch Davidian,Clive Doyle, , ,"Rowman &amp; Littlefield Publishers, Inc.",9781442208872,07/25/2012,298, ,"814,337", , , ,$38.58,$28.99, 
685,Red Carpets and Other Banana Skins: The Autobiography,Rupert Everett, , ,Grand Central Publishing,9780759571396,01/18/2007, , ,"815,178",4,4.3, ,$9.99,$9.99, 
686,Crazy Days: My Autobiography,Sadie Frost, , ,"John Blake Publishing, Limited",9781843587910,10/15/2010,262, ,"815,182",1,4.0, ,$8.49,$8.49, 
687,"The Oldest Pioneer: Autobiography of Charles Peters (Abridged, Annotated)",Charles Peters, , ,Big Byte Books,2940150848559,06/26/2015, , ,"815,194", , , , , , 
688,"Bill W., My First 40 Years: An Autobiography",the Co-founder of AA, , ,Hazelden Publishing,9781616490010,05/14/2010,232, ,"816,446",2,5.0,$13.53, ,$10.49, 
689,My Quests for Hope and Meaning: An Autobiography,Rosemary Radford Ruether, , ,Wipf &amp; Stock Publishers,9781620327128,10/02/2013,195,6.00(w) x 8.90(h) x 0.50(d),"816,949", , ,$23.00, ,$10.49, 
690,The Autobiography of John Stuart Mill (Barnes & Noble Digital Library),John Stuart Mill, , ,Barnes &amp; Noble,9781411458253,07/12/2011,276, ,"818,641",1,5.0,$8.99, ,$1.99,$29.95
691,Israel Rank: The Autobiography of a Criminal,Roy Horniman, , ,Faber and Faber,9780571315451,04/24/2014,414, ,"819,317", , ,$24.00, ,$10.99, 
692,An Autobiography of George Washington,Edith Ellis, , ,"Hay House, Inc.",9781401932114,07/01/2006, , ,"820,395",3,2.6,$14.58, ,$2.99, 
693,Black Beauty : The Autobiography of a Horse (Illustrated),Anna Sewell, , ,Lulu.com,9781304059666,05/22/2013, , ,"821,189",9,4.1,$7.99, ,$1.99, 
694,"99 Cent Best Seller Feng Shui Improves Productivity In Cu ( autobiography, diary, journal, life, life story, memoir, picture, profile, sketch, confessions, experience, letter, life history, personal account )",Resounding Wind Publishing, , ,Resounding Wind Publishing,2940150017177,09/19/2014, , ,"822,873",1,5.0, , , , 
695,Reading Arab Women's Autobiographies,Nawar Al-Hassan Golley, , ,University of Texas Press,9780292705456,11/01/2003,256,6.00(w) x 8.90(h) x 0.70(d),"823,853", , ,$25.00, ,$23.49, 
696,Drinks All Round: The Autobiography,Kevin Driscoll,Scott Burns, ,Black &amp; White Publishing,9781845029203,10/25/2010,256, ,"825,215", , , ,$2.90,$2.90, 
697,George Fox: An Autobiography,George Fox, , ,Jawbone Digital,2940149920068,01/21/2015, , ,"825,784", , , , ,$0.99, 
698,Autobiography,Madame Guyon, , ,Lulu.com,9781300239567,09/26/2012, , ,"827,023", , , , , , 
699,That Thing You Do With Your Mouth: The Sexual Autobiography of Samantha Matthews as Told to David Shields,David Shields,Samantha Matthews, ,McSweeney's Publishing,9781940450810,06/09/2015,160, ,"827,212", , ,$11.43, ,$9.99, 
700,James Weldon Johnson: The Autobiography of an Ex-Colored Man,James Weldon Johnson, , ,CreateSpace Independent Publishing Platform,9781452826615,04/22/2010,102,6.00(w) x 9.00(h) x 0.21(d),"829,717", , ,$6.99, , ,$22.99
701,An Autobiography of General Custer,Stephen Brennan, , ,Skyhorse Publishing,9781620878194,10/17/2012,256, ,"831,352", , , ,$15.49,$15.49, 
702,Over the Moon: My Autobiography,David Essex,Various, ,Ebury Publishing,9780753547632,03/01/2012,320, ,"834,280", , ,$14.95,$34.95,$10.49, 
703,A Peculiar Treasure: An Autobiography,Edna Ferber, , ,Knopf Doubleday Publishing Group,9780345805799,03/04/2014,400, ,"834,495", , , ,$11.99,$11.99, 
704,Vanity Will Get You Somewhere: An Autobiography,Joseph Cotten, , ,"iUniverse, Incorporated",9780595091331,03/24/2000,280,6.00(w) x 9.00(h) x 0.63(d),"835,231",2,3.5,$16.95, , , 
705,"Interfaces: Women, Autobiography, Image, Performance",Sidonie Ann Smith, , ,University of Michigan Press,9780472068142,12/20/2002,496,6.13(w) x 9.25(h) x 1.10(d),"836,926", , ,$30.88, , , 
706,Autobiography of Charles Darwin : Edited,his Son Francis Darwin, , ,MobileReference,9781605016344,01/01/2010, , ,"837,736", , , , , , 
707,Red: My Autobiography,Gary Neville, , ,Transworld Publishers Limited,9781446465196,09/01/2011,416, ,"839,070", , ,$11.34, ,$9.99, 
708,The Autobiography Of Abbie Hoffman,Abbie Hoffman, , ,Da Capo Press,9781568581972,11/01/2000,332,0.74(w) x 5.50(h) x 8.50(d),"839,331",2,4.0,$12.27, , , 
709,The Autobiography of Andrew Carnegie with Illustrations,Andrew Carnegie, , ,Unforgotten Classics,2940016352145,03/08/2013, , ,"842,202", , , , , , 
710,The Autobiography of Benjamin Franklin,Benjamin Franklin, , ,CreateSpace Publishing,9781497421318,03/22/2014,130,8.50(w) x 11.00(h) x 0.28(d),"842,223",1,3.0,$9.99, ,$0.00, 
711,Compleated Autobiography of Benjamin Franklin,Mark Skousen,Benjamin Franklin, ,Regnery Publishing,9780895260338,12/15/2005,256,6.16(w) x 9.04(h) x 1.64(d),"844,160",1,5.0, , , , 
712,An Autobiography of Jack London,Stephen Brennan, , ,Skyhorse Publishing,9781620879535,01/28/2013,448, ,"845,133", , , ,$22.65,$13.99, 
713,Autobiography,Johann Wolfgang von Goethe, , ,CreateSpace Publishing,9781511722964,04/13/2015,300,6.00(w) x 9.00(h) x 0.63(d),"845,851", , ,$20.90, ,$0.00, 
714,The Milesian Mistress. The Autobiography of Aspasia of Miletus,Garrison, , ,Elise Garrison,2940012960399,06/16/2011, , ,"846,115", , , , , , 
715,"Modern Living in China: China ( autobiography, diary, journal, life, life story, memoir, picture, profile, sketch, confessions, experience, letter, life history, personal account )",Resounding Wind Publishing, , ,Resounding Wind Publishing,2940150477681,12/20/2014, , ,"846,260",2,5.0, , , , 
716,Up from Slavery : An Autobiography (Illustrated),Booker T. Washington, , ,Lulu.com,9781300323471,10/20/2012, , ,"846,869", , ,$20.96,$26.95,$1.99, 
717,Carra: My Autobiography,Jamie Carragher, , ,Transworld Publishers Limited,9780552157421,11/01/2009,384,4.96(w) x 7.78(h) x 1.33(d),"847,929", , ,$12.51, ,$9.99, 
718,An Autobiography of Buffalo Bill (Colonel W. F. Cody),Buffalo Bill, , ,MVB E-Books,9783655118917,01/01/2010, , ,"849,368", , ,$21.74, ,$2.99, 
719,The Autobiography of Mulan (Book One of the Princess Series),Katie Morris, , ,Golgotha Press,2940012363275,04/17/2011, , ,"850,250",4,4.0, , , , 
