ID,title,year,director,writer,actor
002204, Sex and Lucia, 2001, Julio Medem, Julio Medem, Paz Vega; Tristán Ulloa; Najwa Nimri
002205, Deja Vu, 2006, Tony Scott, Bill Marsilii; Terry Rossio, Denzel Washington; Paula Patton; Jim Caviezel
002206, The Raven(I), 2012, James McTeigue, Hannah Shakespeare; Ben Livingston, John Cusack; Alice Eve; Luke Evans
002207, 21, 2008, Robert Luketic, Peter Steinfeld; Allan Loeb, Jim Sturgess; Kate Bosworth; Kevin Spacey
002208, Mr. Deeds, 2002, Steven Brill, Clarence Budington Kelland; Robert Riskin, Adam Sandler; Winona Ryder; John Turturro
002209, Super(I), 2010, James Gunn, James Gunn, Rainn Wilson; Ellen Page; Liv Tyler
002210, The Good Shepherd, 2006, Robert De Niro, Eric Roth, Matt Damon; Angelina Jolie; Robert De Niro
002211, Blue Lagoon: The Awakening, 2012, Mikael Salomon, Henry De Vere Stacpoole; Matt Heller, Indiana Evans; Brenton Thwaites; Denise Richards
002212, Contracted: Phase II, 2015, Josh Forbes, Craig Walendziak, Matt Mercer; Marianna Palka; Morgan Peter Brown
002213, Catwoman, 2004, Pitof, Bob Kane; Theresa Rebeck, Halle Berry; Sharon Stone; Benjamin Bratt
002214, Me Before You, 2016, Thea Sharrock, Jojo Moyes; Jojo Moyes, Emilia Clarke; Jenna Coleman; Sam Claflin
002215, Glory, 1989, Edward Zwick, Kevin Jarre; Lincoln Kirstein, Matthew Broderick; Denzel Washington; Cary Elwes
002216, Abduction(I), 2011, John Singleton, Shawn Christensen, Taylor Lautner; Lily Collins; Alfred Molina
002217, Final Destination 3, 2006, James Wong, Glen Morgan; James Wong, Mary Elizabeth Winstead; Ryan Merriman; Kris Lemche
002218, The Man with the Iron Fists, 2012, RZA, RZA; RZA, Russell Crowe; Cung Le; Lucy Liu
002219, Maryland, 2015, Alice Winocour, Alice Winocour; Jean-Stéphane Bron, Matthias Schoenaerts; Diane Kruger; Jean-Louis Coulloc'h
002220, Mary Shelley's Frankenstein, 1994, Kenneth Branagh, Mary Shelley; Steph Lady, Robert De Niro; Kenneth Branagh; Helena Bonham Carter
002221, The Lincoln Lawyer, 2011, Brad Furman, John Romano; Michael Connelly, Matthew McConaughey; Marisa Tomei; Ryan Phillippe
002222, Mean Girls 2, 2011, Melanie Mayron, Allison Schroeder; Elana Lesser, Meaghan Martin; Donn Lamkin; Linden Ashby
002223, Nim's Island, 2008, Jennifer Flackett; Mark Levin, Joseph Kwong; Paula Mazur, Jodie Foster; Gerard Butler; Abigail Breslin
002224, Cut Bank, 2014, Matt Shakman, Roberto Patino, Teresa Palmer; Liam Hemsworth; Billy Bob Thornton
002225, A Streetcar Named Desire, 1951, Elia Kazan, Tennessee Williams; Oscar Saul, Vivien Leigh; Marlon Brando; Kim Hunter
002226, Death Race, 2008, Paul W.S. Anderson, Paul W.S. Anderson; Paul W.S. Anderson, Jason Statham; Joan Allen; Tyrese Gibson
002227, 101 Dalmatians, 1961, Clyde Geronimi; Hamilton Luske, Bill Peet; Dodie Smith, Rod Taylor; Betty Lou Gerson; J. Pat O'Malley
002228, Underworld: Evolution, 2006, Len Wiseman, Danny McBride; Len Wiseman, Kate Beckinsale; Scott Speedman; Bill Nighy
002229, Glengarry Glen Ross, 1992, James Foley, David Mamet; David Mamet, Al Pacino; Jack Lemmon; Alec Baldwin
002230, Brick Mansions, 2014, Camille Delamarre, Luc Besson; Luc Besson, Paul Walker; David Belle; RZA
002231, The Hangover Part II, 2011, Todd Phillips, Craig Mazin; Scot Armstrong, Bradley Cooper; Zach Galifianakis; Ed Helms
002232, Mr. Peabody &amp; Sherman, 2014, Rob Minkoff, Jay Ward; Craig Wright, Ty Burrell; Max Charles; Stephen Colbert
002233, Can't Hardly Wait, 1998, Harry Elfont; Deborah Kaplan, Deborah Kaplan; Harry Elfont, Jennifer Love Hewitt; Ethan Embry; Charlie Korsmo
002234, Europa Report, 2013, Sebastián Cordero, Philip Gelatt, Sharlto Copley; Michael Nyqvist; Christian Camargo
002235, St. Elmo's Fire, 1985, Joel Schumacher, Joel Schumacher; Carl Kurlander, Demi Moore; Rob Lowe; Andrew McCarthy
002236, Newsies, 1992, Kenny Ortega, Bob Tzudiker; Noni White, Christian Bale; Bill Pullman; Robert Duvall
002237, The Haunting, 1963, Robert Wise, Nelson Gidding; Shirley Jackson, Julie Harris; Claire Bloom; Richard Johnson
002238, LOL, 2012, Lisa Azuelos, Lisa Azuelos; Kamir Aïnouz, Miley Cyrus; Douglas Booth; Ashley Greene
002239, Cry-Baby, 1990, John Waters, John Waters, Johnny Depp; Ricki Lake; Amy Locane
002240, The Ghost Writer, 2010, Roman Polanski, Robert Harris; Roman Polanski, Ewan McGregor; Pierce Brosnan; Olivia Williams
002241, Scary Movie 5, 2013, Malcolm D. Lee; David Zucker, David Zucker; Pat Proft, Simon Rex; Ashley Tisdale; Charlie Sheen
002242, The Darjeeling Limited, 2007, Wes Anderson, Wes Anderson; Roman Coppola, Owen Wilson; Adrien Brody; Jason Schwartzman
002243, Miss Meadows, 2014, Karen Leigh Hopkins, Karen Leigh Hopkins, Katie Holmes; James Badge Dale; Callan Mulvey
002244, The American, 2010, Anton Corbijn, Rowan Joffe; Martin Booth, George Clooney; Paolo Bonacelli; Violante Placido
002245, Top Gun 2, , , Peter Craig; Justin Marks, Tom Cruise
002246, Scary Movie 2, 2001, Keenen Ivory Wayans, Shawn Wayans; Marlon Wayans, Anna Faris; Marlon Wayans; Antony Acker
002247, Stuart Little, 1999, Rob Minkoff, E.B. White; M. Night Shyamalan, Michael J. Fox; Geena Davis; Hugh Laurie
002248, Varsity Blues, 1999, Brian Robbins, W. Peter Iliff, James Van Der Beek; Jon Voight; Paul Walker
002249, Max Payne, 2008, John Moore, Beau Thorne; Sam Lake, Mark Wahlberg; Mila Kunis; Beau Bridges
002250, Staten Island Summer(II), 2015, Rhys Thomas, Colin Jost, Graham Phillips; Zack Pearlman; Ashley Greene
002251, Scream 3, 2000, Wes Craven, Kevin Williamson; Ehren Kruger, David Arquette; Neve Campbell; Courteney Cox
002252, School Ties, 1992, Robert Mandel, Dick Wolf; Dick Wolf, Brendan Fraser; Matt Damon; Chris O'Donnell
002253, Horton Hears a Who!, 2008, Jimmy Hayward; Steve Martino, Ken Daurio; Cinco Paul, Jim Carrey; Steve Carell; Carol Burnett
002254, Boat Trip, 2002, Mort Nathan, Mort Nathan; William Bigelow, Cuba Gooding Jr.; Horatio Sanz; Roselyn Sanchez
002255, Broken(IV), 2012, Rufus Norris, Daniel Clay; Mark O'Rowe, Charlie Booty; Lily James; Tim Roth
002256, The Girl Who Played with Fire, , David Fincher, Stieg Larsson; Andrew Kevin Walker, Rooney Mara; Daniel Craig
002257, You Don't Mess with the Zohan, 2008, Dennis Dugan, Adam Sandler; Robert Smigel, Adam Sandler; John Turturro; Emmanuelle Chriqui
002258, Lost Highway, 1997, David Lynch, David Lynch; Barry Gifford, Bill Pullman; Patricia Arquette; John Roselius
002259, I Saw the Devil, 2010, Jee-woon Kim, Jee-woon Kim; Hoon-jung Park, Byung-hun Lee; Min-sik Choi; In-seo Kim
002260, Something's Gotta Give, 2003, Nancy Meyers, Nancy Meyers, Jack Nicholson; Diane Keaton; Keanu Reeves
002261, The Hours, 2002, Stephen Daldry, Michael Cunningham; David Hare, Meryl Streep; Nicole Kidman; Julianne Moore
002262, Lost in Space, 1998, Stephen Hopkins, Irwin Allen; Akiva Goldsman, Gary Oldman; William Hurt; Matt LeBlanc
002263, Kindergarten Cop, 1990, Ivan Reitman, Murray Salem; Murray Salem, Arnold Schwarzenegger; Penelope Ann Miller; Pamela Reed
002264, [Rec], 2007, Jaume Balagueró; Paco Plaza, Jaume Balagueró; Luiso Berdejo, Manuela Velasco; Ferran Terraza; Jorge-Yamam Serrano
002265, Flash Gordon, 1980, Mike Hodges, Lorenzo Semple Jr.; Michael Allin, Sam J. Jones; Melody Anderson; Max von Sydow
002266, Fruitvale Station, 2013, Ryan Coogler, Ryan Coogler, Michael B. Jordan; Melonie Diaz; Octavia Spencer
002267, Rocky II, 1979, Sylvester Stallone, Sylvester Stallone, Sylvester Stallone; Talia Shire; Burt Young
002268, Punisher: War Zone, 2008, Lexi Alexander, Nick Santora; Art Marcum, Ray Stevenson; Dominic West; Julie Benz
002269, Deadfall, 2012, Stefan Ruzowitzky, Zach Dean, Eric Bana; Olivia Wilde; Charlie Hunnam
002270, Madagascar 3: Europe's Most Wanted, 2012, Eric Darnell; Tom McGrath, Eric Darnell; Noah Baumbach, Ben Stiller; Jada Pinkett Smith; Chris Rock
002271, Kingpin, 1996, Bobby Farrelly; Peter Farrelly, Barry Fanaro; Mort Nathan, Woody Harrelson; Randy Quaid; Bill Murray
002272, S.W.A.T., 2003, Clark Johnson, Robert Hamner; Ron Mita, Samuel L. Jackson; Colin Farrell; Michelle Rodriguez
002273, American Wedding, 2003, Jesse Dylan, Adam Herz; Adam Herz, Jason Biggs; Alyson Hannigan; Seann William Scott
002274, Walt Before Mickey, 2015, Khoa Le, Arthur L. Bernstein; Armando Gutierrez, Jodie Sweetin; Jon Heder; David Henrie
002275, Cinema Paradiso, 1988, Giuseppe Tornatore, Giuseppe Tornatore; Giuseppe Tornatore, Philippe Noiret; Enzo Cannavale; Antonella Attili
002276, Safety Not Guaranteed, 2012, Colin Trevorrow, Derek Connolly, Aubrey Plaza; Mark Duplass; Jake Johnson
002277, Dil Dhadakne Do, 2015, Zoya Akhtar, Zoya Akhtar; Reema Kagti, Anil Kapoor; Shefali Shetty; Priyanka Chopra
002278, I Am Sam, 2001, Jessie Nelson, Kristine Johnson; Jessie Nelson, Sean Penn; Michelle Pfeiffer; Dakota Fanning
002279, Saved!, 2004, Brian Dannelly, Brian Dannelly; Michael Urban, Jena Malone; Mandy Moore; Macaulay Culkin
002280, The Time Traveler's Wife, 2009, Robert Schwentke, Bruce Joel Rubin; Audrey Niffenegger, Eric Bana; Rachel McAdams; Ron Livingston
002281, Rushmore, 1998, Wes Anderson, Wes Anderson; Owen Wilson, Jason Schwartzman; Bill Murray; Olivia Williams
002282, Amores Perros, 2000, Alejandro González Iñárritu, Guillermo Arriaga, Emilio Echevarría; Gael García Bernal; Goya Toledo
002283, A Scanner Darkly, 2006, Richard Linklater, Philip K. Dick; Richard Linklater, Keanu Reeves; Winona Ryder; Robert Downey Jr.
002284, National Treasure 3, , Jon Turteltaub, Aaron Benay; Matthew Benay, Nicolas Cage
002285, Cowboys &amp; Aliens, 2011, Jon Favreau, Roberto Orci; Alex Kurtzman, Daniel Craig; Harrison Ford; Olivia Wilde
002286, When in Rome, 2010, Mark Steven Johnson, David Diamond; David Weissman, Kristen Bell; Josh Duhamel; Anjelica Huston
002287, Saw II, 2005, Darren Lynn Bousman, Leigh Whannell; Darren Lynn Bousman, Donnie Wahlberg; Beverley Mitchell; Franky G
002288, Charlie Countryman, 2013, Fredrik Bond, Matt Drake, Shia LaBeouf; Evan Rachel Wood; Mads Mikkelsen
002289, A Nightmare on Elm Street 2: Freddy's Revenge, 1985, Jack Sholder, David Chaskin; Wes Craven, Robert Englund; Mark Patton; Kim Myers
002290, The Orphanage, 2007, J.A. Bayona, Sergio G. Sánchez, Belén Rueda; Fernando Cayo; Roger Príncep
002291, The East, 2013, Zal Batmanglij, Zal Batmanglij; Brit Marling, Brit Marling; Alexander Skarsgård; Ellen Page
002292, August Rush, 2007, Kirsten Sheridan, Nick Castle; James V. Hart, Freddie Highmore; Keri Russell; Jonathan Rhys Meyers
002293, Shrek the Third, 2007, Chris Miller; Raman Hui, William Steig; Andrew Adamson, Mike Myers; Cameron Diaz; Eddie Murphy
002294, Sharknado, 2013, Anthony C. Ferrante, Thunder Levin, Ian Ziering; Tara Reid; John Heard
002295, Wait Until Dark, 1967, Terence Young, Frederick Knott; Robert Carrington, Audrey Hepburn; Alan Arkin; Richard Crenna
002296, Blood Ties(I), 2013, Guillaume Canet, Guillaume Canet; James Gray, Clive Owen; Marion Cotillard; Billy Crudup
002297, Hyena Road, 2015, Paul Gross, Paul Gross, Rossif Sutherland; Paul Gross; Clark Johnson
002298, Where the Wild Things Are, 2009, Spike Jonze, Spike Jonze; Dave Eggers, Max Records; Catherine O'Hara; Forest Whitaker
002299, Boychoir, 2014, François Girard, Ben Ripley, Dustin Hoffman; Kevin McHale; Josh Lucas
002300, Spare Parts(I), 2015, Sean McNamara, Joshua Davis; Elissa Matsueda, George Lopez; Jamie Lee Curtis; Carlos PenaVega
002301, Beverly Hills Cop, 1984, Martin Brest, Daniel Petrie Jr.; Danilo Bach, Eddie Murphy; Judge Reinhold; John Ashton
002302, Untitled Wolverine Sequel, 2017, James Mangold, Michael Green, Hugh Jackman; Patrick Stewart
002303, Reservation Road, 2007, Terry George, John Burnham Schwartz; Terry George, Joaquin Phoenix; Mark Ruffalo; Jennifer Connelly
002304, Ghost World, 2001, Terry Zwigoff, Daniel Clowes; Daniel Clowes, Steve Buscemi; Thora Birch; Scarlett Johansson
002305, Popeye, 1980, Robert Altman, Jules Feiffer; E.C. Segar, Robin Williams; Shelley Duvall; Ray Walston
002306, Street Kings, 2008, David Ayer, James Ellroy; Kurt Wimmer, Keanu Reeves; Forest Whitaker; Hugh Laurie
002307, The Irishman(I), , , , 
002308, Charlie Wilson's War, 2007, Mike Nichols, Aaron Sorkin; George Crile, Tom Hanks; Julia Roberts; Philip Seymour Hoffman
002309, Charlie's Angels: Full Throttle, 2003, McG, Ivan Goff; Ben Roberts, Drew Barrymore; Lucy Liu; Cameron Diaz
002310, Of Mice and Men, 1992, Gary Sinise, John Steinbeck; Horton Foote, John Malkovich; Gary Sinise; Ray Walston
002311, WarGames, 1983, John Badham, Lawrence Lasker; Walter F. Parkes, Matthew Broderick; Ally Sheedy; John Wood
002312, Friday the 13th Part VIII: Jason Takes Manhattan, 1989, Rob Hedden, Rob Hedden; Victor Miller, Jensen Daggett; Kane Hodder; Todd Caldecott
002313, Zombeavers, 2014, Jordan Rubin, Al Kaplan; Jordan Rubin, Rachel Melvin; Cortney Palm; Lexi Atkins
002314, Eden(II), 2014, Mia Hansen-Løve, Mia Hansen-Løve; Sven Hansen-Løve, Félix de Givry; Pauline Etienne; Vincent Macaigne
002315, Twin Peaks: Fire Walk with Me, 1992, David Lynch, David Lynch; Robert Engels, Sheryl Lee; Ray Wise; Mädchen Amick
002316, The Fifth Estate, 2013, Bill Condon, Daniel Domscheit-Berg; David Leigh, Benedict Cumberbatch; Daniel Brühl; Carice van Houten
002317, Mary and Max, 2009, Adam Elliot, Adam Elliot, Toni Collette; Philip Seymour Hoffman; Eric Bana
002318, The Mask of Zorro, 1998, Martin Campbell, Johnston McCulley; Ted Elliott, Antonio Banderas; Anthony Hopkins; Catherine Zeta-Jones
002319, Think Like a Man Too, 2014, Tim Story, Keith Merryman; David A. Newman, Kevin Hart; Gabrielle Union; Wendi McLendon-Covey
002320, The Gift, 2000, Sam Raimi, Billy Bob Thornton; Tom Epperson, Cate Blanchett; Katie Holmes; Keanu Reeves
002321, Philadelphia, 1993, Jonathan Demme, Ron Nyswaner, Tom Hanks; Denzel Washington; Roberta Maxwell
002322, A Night at the Roxbury, 1998, John Fortenberry; Amy Heckerling, Steve Koren; Will Ferrell, Chris Kattan; Will Ferrell; Raquel Gardner
002323, Dogville, 2003, Lars von Trier, Lars von Trier, Nicole Kidman; Paul Bettany; Lauren Bacall
002324, Black Snake Moan, 2006, Craig Brewer, Craig Brewer, Christina Ricci; Samuel L. Jackson; Justin Timberlake
002325, Super Mario Bros., 1993, Annabel Jankel; Rocky Morton, Parker Bennett; Terry Runte, Bob Hoskins; John Leguizamo; Dennis Hopper
002326, The Bodyguard, 1992, Mick Jackson, Lawrence Kasdan, Kevin Costner; Whitney Houston; Gary Kemp
002327, City of Ember, 2008, Gil Kenan, Caroline Thompson; Jeanne Duprau, Saoirse Ronan; Toby Jones; Bill Murray
002328, Space Jam, 1996, Joe Pytka, Leo Benvenuti; Steve Rudnick, Michael Jordan; Wayne Knight; Theresa Randle
002329, Redemption(I), 2013, Steven Knight, Steven Knight, Jason Statham; Agata Buzek; Vicky McClure
002330, Partisan, 2015, Ariel Kleiman, Sarah Cyngler; Ariel Kleiman, Vincent Cassel; Jeremy Chabriel; Florence Mezzara
002331, Untitled Neill Blomkamp/Alien Project, 2017, Neill Blomkamp, Neill Blomkamp; Dan O'Bannon, Sigourney Weaver; Michael Biehn
002332, Wall Street: Money Never Sleeps, 2010, Oliver Stone, Allan Loeb; Stephen Schiff, Shia LaBeouf; Michael Douglas; Carey Mulligan
002333, The Wolfman, 2010, Joe Johnston, Andrew Kevin Walker; David Self, Benicio Del Toro; Anthony Hopkins; Emily Blunt
002335, Dragonball: Evolution, 2009, James Wong, Ben Ramsey; Akira Toriyama, Justin Chatwin; James Marsters; Yun-Fat Chow
002336, Chitty Chitty Bang Bang, 1968, Ken Hughes, Roald Dahl; Ian Fleming, Dick Van Dyke; Sally Ann Howes; Lionel Jeffries
002337, Untitled Terrence Malick Project, 2016, Terrence Malick, Terrence Malick, Michael Fassbender; Rooney Mara; Christian Bale
002338, Friday the 13th Part VII: The New Blood, 1988, John Carl Buechler, Daryl Haney; Manuel Fidello, Jennifer Banko; John Otrin; Susan Blu
002339, Papillon, 1973, Franklin J. Schaffner, Dalton Trumbo; Lorenzo Semple Jr., Steve McQueen; Dustin Hoffman; Victor Jory
002340, Bad Boys 3, 2017, Joe Carnahan, David Guggenheim, Will Smith; Martin Lawrence
002341, The Firm, 1993, Sydney Pollack, John Grisham; David Rabe, Tom Cruise; Jeanne Tripplehorn; Gene Hackman
002343, In a World..., 2013, Lake Bell, Lake Bell, Lake Bell; Fred Melamed; Michaela Watkins
002344, Death Note, , Adam Wingard, Tsugumi Ohba; Takeshi Obata, Nat Wolff; Nate Wolff
002345, Miami Vice, 2006, Michael Mann, Michael Mann; Anthony Yerkovich, Colin Farrell; Jamie Foxx; Li Gong
002346, Ice Age: Continental Drift, 2012, Steve Martino; Mike Thurmeier, Michael Berg; Jason Fuchs, Ray Romano; Denis Leary; John Leguizamo
002347, Get on Up, 2014, Tate Taylor, Jez Butterworth; John-Henry Butterworth, Chadwick Boseman; Nelsan Ellis; Dan Aykroyd
002348, They Came Together, 2014, David Wain, Michael Showalter; David Wain, Paul Rudd; Amy Poehler; Bill Hader
002349, Omoide no Mânî, 2014, Hiromasa Yonebayashi, Joan G. Robinson; Keiko Niwa, Sara Takatsuki; Kasumi Arimura; Nanako Matsushima
002350, State of Play, 2009, Kevin Macdonald, Matthew Michael Carnahan; Tony Gilroy, Russell Crowe; Rachel McAdams; Ben Affleck
002351, Dial M for Murder, 1954, Alfred Hitchcock, Frederick Knott; Frederick Knott, Ray Milland; Grace Kelly; Robert Cummings
002352, The Switch(I), 2010, Josh Gordon; Will Speck, Allan Loeb; Jeffrey Eugenides, Jennifer Aniston; Jason Bateman; Patrick Wilson
002353, The Magnificent Seven, 1960, John Sturges, William Roberts, Yul Brynner; Steve McQueen; Charles Bronson
002354, James and the Giant Peach, 1996, Henry Selick, Roald Dahl; Karey Kirkpatrick, Paul Terry; Joanna Lumley; Pete Postlethwaite
002355, Pirate Radio, 2009, Richard Curtis, Richard Curtis, Philip Seymour Hoffman; Bill Nighy; Nick Frost
002356, The Dead Lands, 2014, Toa Fraser, Glenn Standring, James Rolleston; Lawrence Makoare; Te Kohe Tuhaka
002357, Air Force One, 1997, Wolfgang Petersen, Andrew W. Marlowe, Harrison Ford; Gary Oldman; Glenn Close
002358, Nick and Norah's Infinite Playlist, 2008, Peter Sollett, Lorene Scafaria; Rachel Cohn, Michael Cera; Kat Dennings; Aaron Yoo
002359, How to Train Your Dragon 3, 2018, Dean DeBlois, Dean DeBlois; Dean DeBlois, Kristen Wiig; Gerard Butler; Cate Blanchett
002360, Sunset Blvd., 1950, Billy Wilder, Charles Brackett; Billy Wilder, William Holden; Gloria Swanson; Erich von Stroheim
002362, Do the Right Thing, 1989, Spike Lee, Spike Lee, Danny Aiello; Ossie Davis; Ruby Dee
002363, Three Kings, 1999, David O. Russell, John Ridley; David O. Russell, George Clooney; Mark Wahlberg; Ice Cube
002364, The Flash, 2018, Seth Grahame-Smith, Gardner Fox; Seth Grahame-Smith, Ezra Miller
002365, Original Sin, 2001, Michael Cristofer, Cornell Woolrich; Michael Cristofer, Antonio Banderas; Angelina Jolie; Thomas Jane
002366, Kill Your Friends, 2015, Owen Harris, Daniel Barker; John Niven, Nicholas Hoult; Ed Skrein; James Corden
002367, Sanctum, 2011, Alister Grierson, John Garvin; Andrew Wight, Rhys Wakefield; Allison Cratchley; Christopher James Baker
002368, Splice, 2009, Vincenzo Natali, Vincenzo Natali; Antoinette Terry Bryant, Adrien Brody; Sarah Polley; Delphine Chanéac
002369, Bachelor Party, 1984, Neal Israel, Bob Israel; Neal Israel, Tom Hanks; Tawny Kitaen; Adrian Zmed
002370, A Bronx Tale, 1993, Robert De Niro, Chazz Palminteri; Chazz Palminteri, Robert De Niro; Chazz Palminteri; Lillo Brancato
002371, Scary Movie 3, 2003, David Zucker, Craig Mazin; Pat Proft, Anna Faris; Charlie Sheen; Regina Hall
002372, Devil's Knot, 2013, Atom Egoyan, Paul Harris Boardman; Scott Derrickson, Colin Firth; Reese Witherspoon; Alessandro Nivola
002373, Prem Ratan Dhan Payo, 2015, Sooraj R. Barjatya, Sooraj R. Barjatya; Aash Karan Atal, Salman Khan; Sonam Kapoor; Anupam Kher
002374, Evolution, 2001, Ivan Reitman, Don Jakoby; David Diamond, David Duchovny; Orlando Jones; Julianne Moore
002376, All Good Things, 2010, Andrew Jarecki, Marcus Hinchey; Marc Smerling, Ryan Gosling; Kirsten Dunst; Frank Langella
002377, Alice in Wonderland, 1951, Clyde Geronimi; Wilfred Jackson, Lewis Carroll; Winston Hibler, Kathryn Beaumont; Ed Wynn; Richard Haydn
002378, The Last Days on Mars, 2013, Ruairi Robinson, Sydney J. Bounds; Clive Dawson, Liev Schreiber; Elias Koteas; Romola Garai
002379, The Insider, 1999, Michael Mann, Marie Brenner; Eric Roth, Russell Crowe; Al Pacino; Christopher Plummer
002380, Where Hope Grows, 2014, Chris Dowling, Chris Dowling, Kristoffer Polaha; David DeSanctis; Danica McKellar
002381, Killer Joe, 2011, William Friedkin, Tracy Letts; Tracy Letts, Matthew McConaughey; Emile Hirsch; Juno Temple
002382, Pride and Prejudice and Zombies, 2016, Burr Steers, Jane Austen; Seth Grahame-Smith, Lily James; Lena Headey; Matt Smith
002383, Tea and Sympathy, 1956, Vincente Minnelli, Robert Anderson; Robert Anderson, Deborah Kerr; John Kerr; Leif Erickson
002384, Perfect Stranger, 2007, James Foley, Todd Komarnicki; Jon Bokenkamp, Halle Berry; Bruce Willis; Giovanni Ribisi
002385, A Single Man, 2009, Tom Ford, Christopher Isherwood; Tom Ford, Colin Firth; Julianne Moore; Matthew Goode
002386, The Number 23, 2007, Joel Schumacher, Fernley Phillips, Jim Carrey; Virginia Madsen; Logan Lerman
002387, Akira, 1988, Katsuhiro Ôtomo, Katsuhiro Ôtomo; Izô Hashimoto, Nozomu Sasaki; Mami Koyama; Mitsuo Iwata
002388, Jersey Girl, 2004, Kevin Smith, Kevin Smith, Ben Affleck; Liv Tyler; Raquel Castro
002389, Punch-Drunk Love, 2002, Paul Thomas Anderson, Paul Thomas Anderson, Adam Sandler; Emily Watson; Philip Seymour Hoffman
002390, The Running Man, 1987, Paul Michael Glaser, Stephen King; Steven E. de Souza, Arnold Schwarzenegger; Maria Conchita Alonso; Yaphet Kotto
002391, The Land Before Time, 1988, Don Bluth, Stu Krieger; Judy Freudberg, Pat Hingle; Gabriel Damon; Judith Barsi
002392, Cocktail, 1988, Roger Donaldson, Heywood Gould, Tom Cruise; Bryan Brown; Elisabeth Shue
002393, Everly, 2014, Joe Lynch, Yale Hannon; Yale Hannon, Salma Hayek; Hiroyuki Watanabe; Laura Cepeda
002394, Diary of a Wimpy Kid, 2010, Thor Freudenthal, Jackie Filgo; Jeff Filgo, Zachary Gordon; Robert Capron; Rachael Harris
002395, Payback(I), 1999, Brian Helgeland, Donald E. Westlake; Brian Helgeland, Mel Gibson; Gregg Henry; Maria Bello
002396, The Pyramid, 2014, Grégory Levasseur, Daniel Meersand; Nick Simon, Ashley Hinshaw; James Buckley; Denis O'Hare
002397, Tank Girl, 1995, Rachel Talalay, Alan Martin; Jamie Hewlett, Lori Petty; Ice-T; Naomi Watts
002398, Ed Wood, 1994, Tim Burton, Rudolph Grey; Scott Alexander, Johnny Depp; Martin Landau; Sarah Jessica Parker
002399, The Perfect Storm, 2000, Wolfgang Petersen, Sebastian Junger; William D. Wittliff, George Clooney; Mark Wahlberg; Diane Lane
002400, The Duellists, 1977, Ridley Scott, Gerald Vaughan-Hughes; Joseph Conrad, Keith Carradine; Harvey Keitel; Albert Finney
002401, Life of Brian, 1979, Terry Jones, Graham Chapman; John Cleese, Graham Chapman; John Cleese; Michael Palin
002402, Rescue Dawn, 2006, Werner Herzog, Werner Herzog, Christian Bale; Steve Zahn; Jeremy Davies
002403, Wayne's World 2, 1993, Stephen Surjik, Mike Myers; Mike Myers, Mike Myers; Dana Carvey; Christopher Walken
002404, Taken 2, 2012, Olivier Megaton, Luc Besson; Robert Mark Kamen, Liam Neeson; Famke Janssen; Maggie Grace
002405, Nacho Libre, 2006, Jared Hess, Jared Hess; Jerusha Hess, Jack Black; Ana de la Reguera; Héctor Jiménez
002406, Devil's Due, 2014, Matt Bettinelli-Olpin; Tyler Gillett, Lindsay Devlin, Allison Miller; Zach Gilford; Sam Anderson
002407, Sideways, 2004, Alexander Payne, Rex Pickett; Alexander Payne, Paul Giamatti; Thomas Haden Church; Virginia Madsen
002408, I Am Pilgrim, , Matthew Vaughn, Terry Hayes; Terry Hayes, 
002409, Born to Dance, 2015, Tammy Davis, Steve Barr; Hone Kouka, Kherington Payne; John Tui; Kelvin Taylor
002410, Rage, 2014, Paco Cabezas, Jim Agnew; Sean Keller, Nicolas Cage; Rachel Nichols; Max Ryan
002411, The Replacements, 2000, Howard Deutch, Vince McKewin, Keanu Reeves; Gene Hackman; Brooke Langton
002412, Goon, 2011, Michael Dowse, Jay Baruchel; Evan Goldberg, Seann William Scott; Jay Baruchel; Alison Pill
002413, Robot Overlords, 2014, Jon Wright, Mark Stay; Jon Wright, Gillian Anderson; Ben Kingsley; Callan McAuliffe
002414, Rango, 2011, Gore Verbinski, John Logan; John Logan, Johnny Depp; Isla Fisher; Timothy Olyphant
002415, Babe, 1995, Chris Noonan, Dick King-Smith; George Miller, James Cromwell; Magda Szubanski; Christine Cavanaugh
002417, Ghosts of Girlfriends Past, 2009, Mark Waters, Jon Lucas; Scott Moore, Matthew McConaughey; Jennifer Garner; Emma Stone
002418, Silent Hill: Revelation 3D, 2012, Michael J. Bassett, Michael J. Bassett; Laurent Hadida, Adelaide Clemens; Kit Harington; Sean Bean
002419, The Ward, 2010, John Carpenter, Michael Rasmussen; Shawn Rasmussen, Amber Heard; Mamie Gummer; Danielle Panabaker
002420, Barefoot(I), 2014, Andrew Fleming, Stephen Zotnowski, Evan Rachel Wood; Scott Speedman; J.K. Simmons
002421, A Royal Affair, 2012, Nikolaj Arcel, Bodil Steensen-Leth; Rasmus Heisterberg, Alicia Vikander; Mads Mikkelsen; Mikkel Boe Følsgaard
002422, First Daughter, 2004, Forest Whitaker, Jessica Bendinger; Jerry O'Connell, Katie Holmes; Marc Blucas; Michael Keaton
002423, Silverado, 1985, Lawrence Kasdan, Lawrence Kasdan; Mark Kasdan, Kevin Kline; Scott Glenn; Kevin Costner
002424, The Physician, 2013, Philipp Stölzl, Jan Berger; Philipp Stölzl, Tom Payne; Stellan Skarsgård; Olivier Martinez
002425, The Stepfather, 2009, Nelson McCormick, J.S. Cardone; Donald E. Westlake, Penn Badgley; Dylan Walsh; Sela Ward
002426, The Promise, 2016, Terry George, Terry George; Robin Swicord, Christian Bale; Charlotte Le Bon; Oscar Isaac
002427, Jessabelle, 2014, Kevin Greutert, Robert Ben Garant, Sarah Snook; Mark Webber; Joelle Carter
002428, Calendar Girls(II), 2015, Madhur Bhandarkar, Madhur Bhandarkar; Abhiruchi Chand, Akanksha Puri; Avani Modi; Kyra Dutt
