ID,title,year,director,writer,actor
001320, Machete Kills, 2013, Robert Rodriguez, Kyle Ward; Robert Rodriguez, Danny Trejo; Alexa PenaVega; Mel Gibson
001321, Yi ge ren de wu lin, 2014, Teddy Chan, David Chan; Teddy Chan, Donnie Yen; Charlie Yeung; Baoqiang Wang
001322, Mother's Day, 2016, Garry Marshall, Tom Hines; Lily Hollander, Britt Robertson; Jennifer Aniston; Kate Hudson
001323, Fan Girl(I), 2015, Paul Jarrett, Gina O'Brien, Kiernan Shipka; Kara Hayward; Meg Ryan
001324, The Hills Have Eyes, 2006, Alexandre Aja, Alexandre Aja; Grégory Levasseur, Ted Levine; Kathleen Quinlan; Dan Byrd
001325, Palo Alto, 2013, Gia Coppola, Gia Coppola; James Franco, Emma Roberts; James Franco; Jack Kilmer
001326, Hostel: Part II, 2007, Eli Roth, Eli Roth; Eli Roth, Lauren German; Heather Matarazzo; Bijou Phillips
001327, The World Is Not Enough, 1999, Michael Apted, Neal Purvis; Robert Wade, Pierce Brosnan; Sophie Marceau; Robert Carlyle
001328, The Master, 2012, Paul Thomas Anderson, Paul Thomas Anderson, Philip Seymour Hoffman; Joaquin Phoenix; Amy Adams
001329, Jack Ryan: Shadow Recruit, 2014, Kenneth Branagh, Adam Cozad; David Koepp, Chris Pine; Kevin Costner; Keira Knightley
001330, Misery, 1990, Rob Reiner, Stephen King; William Goldman, James Caan; Kathy Bates; Richard Farnsworth
001331, The Transporter, 2002, Louis Leterrier; Corey Yuen, Luc Besson; Robert Mark Kamen, Jason Statham; Qi Shu; Matt Schulze
001332, Road House, 1989, Rowdy Herrington, David Lee Henry; David Lee Henry, Patrick Swayze; Kelly Lynch; Sam Elliott
001333, Sex and the City 2, 2010, Michael Patrick King, Michael Patrick King; Candace Bushnell, Sarah Jessica Parker; Kim Cattrall; Kristin Davis
001334, Red Dragon, 2002, Brett Ratner, Thomas Harris; Ted Tally, Anthony Hopkins; Edward Norton; Ralph Fiennes
001335, 30 Days of Night, 2007, David Slade, Steve Niles; Stuart Beattie, Josh Hartnett; Melissa George; Danny Huston
001337, Coneheads, 1993, Steve Barron, Tom Davis; Dan Aykroyd, Dan Aykroyd; Jane Curtin; Robert Knott
001338, Beautiful Creatures, 2013, Richard LaGravenese, Richard LaGravenese; Kami Garcia, Alice Englert; Viola Davis; Emma Thompson
001339, The Matrix Revolutions, 2003, Andy Wachowski; Lana Wachowski, Andy Wachowski; Lana Wachowski, Keanu Reeves; Laurence Fishburne; Carrie-Anne Moss
001340, Cold Mountain, 2003, Anthony Minghella, Charles Frazier; Anthony Minghella, Jude Law; Nicole Kidman; Renée Zellweger
001341, The Other Guys, 2010, Adam McKay, Adam McKay; Chris Henchy, Will Ferrell; Mark Wahlberg; Derek Jeter
001342, Inside Llewyn Davis, 2013, Ethan Coen; Joel Coen, Joel Coen; Ethan Coen, Oscar Isaac; Carey Mulligan; John Goodman
001343, Groundhog Day, 1993, Harold Ramis, Danny Rubin; Harold Ramis, Bill Murray; Andie MacDowell; Chris Elliott
001344, Coming to America, 1988, John Landis, Eddie Murphy; David Sheffield, Eddie Murphy; Arsenio Hall; James Earl Jones
001345, The Twilight Saga: Breaking Dawn - Part 1, 2011, Bill Condon, Melissa Rosenberg; Stephenie Meyer, Kristen Stewart; Robert Pattinson; Taylor Lautner
001346, Who Framed Roger Rabbit, 1988, Robert Zemeckis, Gary K. Wolf; Jeffrey Price, Bob Hoskins; Christopher Lloyd; Joanna Cassidy
001347, Ouija(II), 2014, Stiles White, Juliet Snowden; Stiles White, Olivia Cooke; Ana Coto; Daren Kagasoff
001348, Resident Evil: Afterlife, 2010, Paul W.S. Anderson, Paul W.S. Anderson, Milla Jovovich; Ali Larter; Wentworth Miller
001349, August: Osage County, 2013, John Wells, Tracy Letts; Tracy Letts, Meryl Streep; Dermot Mulroney; Julia Roberts
001350, Spring(I), 2014, Justin Benson; Aaron Moorhead, Justin Benson, Lou Taylor Pucci; Nadia Hilker; Vanessa Bednar
001351, Kong: Skull Island, 2017, Jordan Vogt-Roberts, Max Borenstein; Derek Connolly, Brie Larson; Tom Hiddleston; Samuel L. Jackson
001352, The Circle, 2016, James Ponsoldt, Dave Eggers; James Ponsoldt, Emma Watson; Karen Gillan; Tom Hanks
001353, Animal House, 1978, John Landis, Harold Ramis; Douglas Kenney, John Belushi; Karen Allen; Tom Hulce
001354, Frank(II), 2014, Lenny Abrahamson, Jon Ronson; Peter Straughan, Michael Fassbender; Domhnall Gleeson; Maggie Gyllenhaal
001355, The Karate Kid, 2010, Harald Zwart, Christopher Murphey; Robert Mark Kamen, Jackie Chan; Jaden Smith; Taraji P. Henson
001356, Anastasia, 1997, Don Bluth; Gary Goldman, Susan Gauthier; Bruce Graham, Meg Ryan; John Cusack; Christopher Lloyd
001357, P.S. I Love You, 2007, Richard LaGravenese, Richard LaGravenese; Steven Rogers, Hilary Swank; Gerard Butler; Harry Connick Jr.
001358, Fantastic Mr. Fox, 2009, Wes Anderson, Roald Dahl; Wes Anderson, George Clooney; Meryl Streep; Bill Murray
001359, Oddball(I), 2015, Stuart McDonald, Peter Ivan, Alan Tudyk; Sarah Snook; Coco Jack Gillies
001360, We Need to Talk About Kevin, 2011, Lynne Ramsay, Lynne Ramsay; Rory Stewart Kinnear, Tilda Swinton; John C. Reilly; Ezra Miller
001361, Magic in the Moonlight, 2014, Woody Allen, Woody Allen, Colin Firth; Emma Stone; Marcia Gay Harden
001362, Your Highness, 2011, David Gordon Green, Danny McBride; Ben Best, Danny McBride; Natalie Portman; James Franco
001363, Alexander, 2004, Oliver Stone, Oliver Stone; Christopher Kyle, Colin Farrell; Anthony Hopkins; Rosario Dawson
001364, Flashdance, 1983, Adrian Lyne, Thomas Hedley Jr.; Joe Eszterhas, Jennifer Beals; Michael Nouri; Lilia Skala
001365, Deliver Us from Evil, 2014, Scott Derrickson, Scott Derrickson; Paul Harris Boardman, Eric Bana; Édgar Ramírez; Olivia Munn
001366, The Cold Light of Day, 2012, Mabrouk El Mechri, Scott Wiper; John Petro, Henry Cavill; Bruce Willis; Sigourney Weaver
001367, Untitled Christopher Nolan Project, 2017, Christopher Nolan, Christopher Nolan, 
001368, Total Recall, 1990, Paul Verhoeven, Philip K. Dick; Ronald Shusett, Arnold Schwarzenegger; Sharon Stone; Michael Ironside
001369, The Virgin Suicides, 1999, Sofia Coppola, Jeffrey Eugenides; Sofia Coppola, Kirsten Dunst; Josh Hartnett; James Woods
001370, Seven Samurai, 1954, Akira Kurosawa, Akira Kurosawa; Shinobu Hashimoto, Toshirô Mifune; Takashi Shimura; Keiko Tsushima
001371, Cheaper by the Dozen, 2003, Shawn Levy, Frank B. Gilbreth Jr.; Ernestine Gilbreth Carey, Steve Martin; Bonnie Hunt; Hilary Duff
001372, The Back-up Plan, 2010, Alan Poul, Kate Angelo, Jennifer Lopez; Alex O'Loughlin; Michaela Watkins
001373, Green Street Hooligans, 2005, Lexi Alexander, Lexi Alexander; Dougie Brimson, Elijah Wood; Charlie Hunnam; Claire Forlani
001374, Jennifer's Body, 2009, Karyn Kusama, Diablo Cody, Megan Fox; Amanda Seyfried; Adam Brody
001375, Wild Things, 1998, John McNaughton, Stephen Peters, Kevin Bacon; Matt Dillon; Neve Campbell
001376, Raging Bull, 1980, Martin Scorsese, Jake LaMotta; Joseph Carter, Robert De Niro; Cathy Moriarty; Joe Pesci
001377, Field of Dreams, 1989, Phil Alden Robinson, W.P. Kinsella; Phil Alden Robinson, Kevin Costner; James Earl Jones; Ray Liotta
001378, Lilo &amp; Stitch, 2002, Dean DeBlois; Chris Sanders, Chris Sanders; Chris Sanders, Daveigh Chase; Chris Sanders; Tia Carrere
001379, The Last Samurai, 2003, Edward Zwick, John Logan; John Logan, Tom Cruise; Ken Watanabe; Billy Connolly
001380, Housebound, 2014, Gerard Johnstone, Gerard Johnstone, Morgana O'Reilly; Rima Te Wiata; Glen-Paul Waru
001381, Alien³, 1992, David Fincher, Dan O'Bannon; Ronald Shusett, Sigourney Weaver; Charles S. Dutton; Charles Dance
001382, Return to Oz, 1985, Walter Murch, L. Frank Baum; Gill Dennis, Fairuza Balk; Nicol Williamson; Jean Marsh
001383, Dredd, 2012, Pete Travis, John Wagner; Carlos Ezquerra, Karl Urban; Olivia Thirlby; Lena Headey
001384, Eden Lake, 2008, James Watkins, James Watkins, Kelly Reilly; Michael Fassbender; Tara Ellis
001385, Pineapple Express, 2008, David Gordon Green, Seth Rogen; Evan Goldberg, Seth Rogen; James Franco; Gary Cole
001386, Annie, 1982, John Huston, Carol Sobieski; Thomas Meehan, Aileen Quinn; Albert Finney; Carol Burnett
001387, Hard Ball, 2001, Brian Robbins, Daniel Coyle; John Gatins, Keanu Reeves; Diane Lane; John Hawkes
001388, Epic Movie, 2007, Jason Friedberg; Aaron Seltzer, Jason Friedberg; Aaron Seltzer, Kal Penn; Jennifer Coolidge; Fred Willard
001389, Bridget Jones's Diary, 2001, Sharon Maguire, Helen Fielding; Helen Fielding, Renée Zellweger; Colin Firth; Hugh Grant
001390, The Descent, 2005, Neil Marshall, Neil Marshall, Shauna Macdonald; Natalie Mendoza; Alex Reid
001391, The Call(II), 2013, Brad Anderson, Richard D'Ovidio; Richard D'Ovidio, Halle Berry; Evie Thompson; Abigail Breslin
001392, The Fountain, 2006, Darren Aronofsky, Darren Aronofsky; Darren Aronofsky, Hugh Jackman; Rachel Weisz; Sean Patrick Thomas
001393, The Woman in Black, 2012, James Watkins, Susan Hill; Jane Goldman, Daniel Radcliffe; Janet McTeer; Ciarán Hinds
001394, Freddy vs. Jason, 2003, Ronny Yu, Wes Craven; Victor Miller, Robert Englund; Ken Kirzinger; Kelly Rowland
001395, The Mask, 1994, Chuck Russell, Michael Fallon; Mark Verheiden, Jim Carrey; Cameron Diaz; Peter Riegert
001396, Thelma &amp; Louise, 1991, Ridley Scott, Callie Khouri, Susan Sarandon; Geena Davis; Harvey Keitel
001397, Sex and the City, 2008, Michael Patrick King, Michael Patrick King; Candace Bushnell, Sarah Jessica Parker; Kim Cattrall; Cynthia Nixon
001398, Man on Fire, 2004, Tony Scott, A.J. Quinnell; Brian Helgeland, Denzel Washington; Christopher Walken; Dakota Fanning
001399, Rock of Ages, 2012, Adam Shankman, Justin Theroux; Chris D'Arienzo, Julianne Hough; Diego Boneta; Tom Cruise
001400, Cannonball Run II, 1984, Hal Needham, Brock Yates; Hal Needham, Burt Reynolds; Dom DeLuise; Frank Sinatra
001401, Paddington, 2014, Paul King, Paul King; Hamish McColl, Hugh Bonneville; Sally Hawkins; Julie Walters
001402, Die Another Day, 2002, Lee Tamahori, Ian Fleming; Neal Purvis, Pierce Brosnan; Halle Berry; Rosamund Pike
001403, Maps to the Stars, 2014, David Cronenberg, Bruce Wagner, Julianne Moore; Mia Wasikowska; Robert Pattinson
001404, Team America: World Police, 2004, Trey Parker, Trey Parker; Matt Stone, Trey Parker; Matt Stone; Elle Russ
001405, The Color Purple, 1985, Steven Spielberg, Alice Walker; Menno Meyjes, Danny Glover; Whoopi Goldberg; Oprah Winfrey
001406, Eragon, 2006, Stefen Fangmeier, Peter Buchman; Christopher Paolini, Ed Speleers; Sienna Guillory; Jeremy Irons
001407, Rosemary's Baby, 1968, Roman Polanski, Ira Levin; Roman Polanski, Mia Farrow; John Cassavetes; Ruth Gordon
001408, Meet Joe Black, 1998, Martin Brest, Ron Osborn; Jeff Reno, Brad Pitt; Anthony Hopkins; Claire Forlani
001409, Step Up All In, 2014, Trish Sie, Duane Adler; John Swetnam, Ryan Guzman; Briana Evigan; Adam G. Sevani
001410, Constantine, 2005, Francis Lawrence, Jamie Delano; Garth Ennis, Keanu Reeves; Rachel Weisz; Djimon Hounsou
001411, Talladega Nights: The Ballad of Ricky Bobby, 2006, Adam McKay, Will Ferrell; Adam McKay, Will Ferrell; John C. Reilly; Sacha Baron Cohen
001412, Antichrist, 2009, Lars von Trier, Lars von Trier, Willem Dafoe; Charlotte Gainsbourg; Storm Acheche Sahlstrøm
001413, Some Kind Of Beautiful, 2014, Tom Vaughan, Matthew Newman, Pierce Brosnan; Salma Hayek; Jessica Alba
001414, Infini, 2015, Shane Abbess, Shane Abbess; Shane Abbess, Daniel MacPherson; Grace Huang; Luke Hemsworth
001415, The Mummy Returns, 2001, Stephen Sommers, Stephen Sommers, Brendan Fraser; Rachel Weisz; John Hannah
001416, Kung Fu Panda, 2008, Mark Osborne; John Stevenson, Jonathan Aibel; Glenn Berger, Jack Black; Ian McShane; Angelina Jolie
001417, Dirty Weekend, 2015, Neil LaBute, Neil LaBute, Matthew Broderick; Alice Eve; Phil Burke
001418, Meet the Parents, 2000, Jay Roach, Greg Glienna; Mary Ruth Clarke, Ben Stiller; Robert De Niro; Teri Polo
001419, Kids, 1995, Larry Clark, Harmony Korine, Leo Fitzpatrick; Justin Pierce; Chloë Sevigny
001420, Never Say Never Again, 1983, Irvin Kershner, Kevin McClory; Jack Whittingham, Sean Connery; Kim Basinger; Klaus Maria Brandauer
001421, Hachi: A Dog's Tale, 2009, Lasse Hallström, Stephen P. Lindsey; Kaneto Shindô, Richard Gere; Joan Allen; Cary-Hiroyuki Tagawa
001422, Rebel Without a Cause, 1955, Nicholas Ray, Stewart Stern; Irving Shulman, James Dean; Natalie Wood; Sal Mineo
001423, Blue Velvet, 1986, David Lynch, David Lynch, Isabella Rossellini; Kyle MacLachlan; Dennis Hopper
001424, Jeepers Creepers, 2001, Victor Salva, Victor Salva, Gina Philips; Justin Long; Jonathan Breck
001425, X2, 2003, Bryan Singer, Zak Penn; David Hayter, Patrick Stewart; Hugh Jackman; Halle Berry
001426, Anchorman: The Legend of Ron Burgundy, 2004, Adam McKay, Will Ferrell; Adam McKay, Will Ferrell; Christina Applegate; Steve Carell
001427, Clue, 1985, Jonathan Lynn, John Landis; Jonathan Lynn, Eileen Brennan; Tim Curry; Madeline Kahn
001428, The Royal Tenenbaums, 2001, Wes Anderson, Wes Anderson; Owen Wilson, Gene Hackman; Gwyneth Paltrow; Anjelica Huston
001429, Men in Black II, 2002, Barry Sonnenfeld, Lowell Cunningham; Robert Gordon, Tommy Lee Jones; Will Smith; Rip Torn
001430, Strangerland, 2015, Kim Farrant, Michael Kinirons; Fiona Seres, Nicole Kidman; Hugo Weaving; Joseph Fiennes
001431, Flowers in the Attic, 2014, Deborah Chow, Kayla Alpert; Virginia C. Andrews, Heather Graham; Ellen Burstyn; Kiernan Shipka
001432, Fright Night, 1985, Tom Holland, Tom Holland, Chris Sarandon; William Ragsdale; Amanda Bearse
001433, Vertigo, 1958, Alfred Hitchcock, Alec Coppel; Samuel A. Taylor, James Stewart; Kim Novak; Barbara Bel Geddes
001434, RED, 2010, Robert Schwentke, Jon Hoeber; Erich Hoeber, Bruce Willis; Helen Mirren; Morgan Freeman
001435, The Polar Express, 2004, Robert Zemeckis, Chris Van Allsburg; Robert Zemeckis, Tom Hanks; Chris Coppola; Michael Jeter
001436, The Texas Chainsaw Massacre, 2003, Marcus Nispel, Kim Henkel; Tobe Hooper, Jessica Biel; Jonathan Tucker; Andrew Bryniarski
001437, Hereafter, 2010, Clint Eastwood, Peter Morgan, Matt Damon; Cécile De France; Bryce Dallas Howard
001438, Who Am I - Kein System ist sicher, 2014, Baran bo Odar, Jantje Friese; Baran bo Odar, Tom Schilling; Elyas M'Barek; Wotan Wilke Möhring
001439, Superman, 1978, Richard Donner, Jerry Siegel; Joe Shuster, Christopher Reeve; Margot Kidder; Gene Hackman
001440, Never Back Down, 2008, Jeff Wadlow, Chris Hauty, Sean Faris; Djimon Hounsou; Amber Heard
001441, Maniac, 2012, Franck Khalfoun, Alexandre Aja; Grégory Levasseur, Elijah Wood; Nora Arnezeder; America Olivo
001442, Side Effects(I), 2013, Steven Soderbergh, Scott Z. Burns, Rooney Mara; Channing Tatum; Jude Law
001443, A Cinderella Story, 2004, Mark Rosman, Leigh Dunlap, Hilary Duff; Chad Michael Murray; Jennifer Coolidge
001444, 2 Fast 2 Furious, 2003, John Singleton, Gary Scott Thompson; Michael Brandt, Paul Walker; Tyrese Gibson; Cole Hauser
001445, Center Stage, 2000, Nicholas Hytner, Carol Heikkinen, Amanda Schull; Ethan Stiefel; Sascha Radetsky
001446, The Chronicles of Narnia: The Voyage of the Dawn Treader, 2010, Michael Apted, Christopher Markus; Stephen McFeely, Ben Barnes; Skandar Keynes; Georgie Henley
001447, Yoga Hosers, 2015, Kevin Smith, Kevin Smith, Johnny Depp; Haley Joel Osment; Natasha Lyonne
001448, 50 First Dates, 2004, Peter Segal, George Wing, Adam Sandler; Drew Barrymore; Rob Schneider
001449, Lovelace, 2013, Rob Epstein; Jeffrey Friedman, Andy Bellin, Amanda Seyfried; James Franco; Peter Sarsgaard
001450, A Royal Night Out, 2015, Julian Jarrold, Trevor De Silva; Kevin Hood, Sarah Gadon; Bel Powley; Emily Watson
001451, Ghost Rider, 2007, Mark Steven Johnson, Mark Steven Johnson; Mark Steven Johnson, Nicolas Cage; Eva Mendes; Sam Elliott
001452, Chocolat, 2000, Lasse Hallström, Joanne Harris; Robert Nelson Jacobs, Juliette Binoche; Judi Dench; Alfred Molina
001453, Mr. Right(I), 2015, Paco Cabezas, Max Landis, Anna Kendrick; Sam Rockwell; Anson Mount
001454, The Bling Ring, 2013, Sofia Coppola, Sofia Coppola; Nancy Jo Sales, Katie Chang; Israel Broussard; Emma Watson
001455, Reach Me, 2014, John Herzfeld, John Herzfeld, Lauren Cohan; Kyra Sedgwick; Thomas Jane
001456, A Few Good Men, 1992, Rob Reiner, Aaron Sorkin; Aaron Sorkin, Tom Cruise; Jack Nicholson; Demi Moore
001457, Collateral, 2004, Michael Mann, Stuart Beattie, Tom Cruise; Jamie Foxx; Jada Pinkett Smith
001458, Caligula, 1979, Tinto Brass; Bob Guccione, Gore Vidal, Malcolm McDowell; Peter O'Toole; Helen Mirren
001459, Hustle &amp; Flow, 2005, Craig Brewer, Craig Brewer, Terrence Howard; Ludacris; Anthony Anderson
001460, The Untouchables, 1987, Brian De Palma, Oscar Fraley; Eliot Ness, Kevin Costner; Sean Connery; Robert De Niro
001461, The Great Escape, 1963, John Sturges, Paul Brickhill; James Clavell, Steve McQueen; James Garner; Richard Attenborough
001462, Suite Française, 2014, Saul Dibb, Matt Charman; Saul Dibb, Michelle Williams; Kristin Scott Thomas; Margot Robbie
001463, Girl House, 2014, Trevor Matthews, Nick Gordon; Nick Gordon, Ali Cobrin; Adam DiMarco; Slaine
001464, Burn After Reading, 2008, Ethan Coen; Joel Coen, Joel Coen; Ethan Coen, Brad Pitt; Frances McDormand; George Clooney
001465, 13 Going on 30, 2004, Gary Winick, Josh Goldsmith; Cathy Yuspa, Jennifer Garner; Mark Ruffalo; Judy Greer
001466, Night at the Museum: Battle of the Smithsonian, 2009, Shawn Levy, Robert Ben Garant; Thomas Lennon, Ben Stiller; Owen Wilson; Amy Adams
001467, 47 Ronin, 2013, Carl Rinsch, Chris Morgan; Hossein Amini, Keanu Reeves; Hiroyuki Sanada; Ko Shibasaki
001468, Hot Tub Time Machine 2, 2015, Steve Pink, Josh Heald; Josh Heald, Rob Corddry; Craig Robinson; Clark Duke
001469, Shaun the Sheep Movie, 2015, Mark Burton; Richard Starzak, Mark Burton; Richard Starzak, Justin Fletcher; John Sparkes; Omid Djalili
001471, Journey 2: The Mysterious Island, 2012, Brad Peyton, Brian Gunn; Mark Gunn, Josh Hutcherson; Dwayne Johnson; Michael Caine
001472, God Bless the Child, 2015, Robert Machoian; Rodrigo Ojeda-Beck, Rebecca Graham; Robert Machoian, Harper Graham; Elias Graham; Arri Graham
001473, The Family(I), 2013, Luc Besson, Luc Besson; Michael Caleo, Robert De Niro; Michelle Pfeiffer; Dianna Agron
001474, Zack and Miri Make a Porno, 2008, Kevin Smith, Kevin Smith, Seth Rogen; Elizabeth Banks; Craig Robinson
001475, How to Lose a Guy in 10 Days, 2003, Donald Petrie, Michele Alexander; Jeannie Long, Kate Hudson; Matthew McConaughey; Adam Goldberg
001476, Short Term 12, 2013, Destin Daniel Cretton, Destin Daniel Cretton, Brie Larson; Frantz Turner; John Gallagher Jr.
001477, Comet, 2014, Sam Esmail, Sam Esmail, Justin Long; Emmy Rossum; Kayla Servi
001478, Addams Family Values, 1993, Barry Sonnenfeld, Charles Addams; Paul Rudnick, Anjelica Huston; Raul Julia; Christopher Lloyd
001479, Jodaeiye Nader az Simin, 2011, Asghar Farhadi, Asghar Farhadi, Peyman Moaadi; Leila Hatami; Sareh Bayat
001480, The Twilight Saga: Eclipse, 2010, David Slade, Melissa Rosenberg; Stephenie Meyer, Kristen Stewart; Robert Pattinson; Taylor Lautner
001481, The Raid 2, 2014, Gareth Evans, Gareth Evans, Iko Uwais; Yayan Ruhian; Arifin Putra
001482, In Your Eyes, 2014, Brin Hill, Joss Whedon, Zoe Kazan; Michael Stahl-David; Mark Feuerstein
001483, Willow, 1988, Ron Howard, George Lucas; Bob Dolman, Val Kilmer; Joanne Whalley; Warwick Davis
001485, Star Wars: Episode VIII, 2017, Rian Johnson, Rian Johnson; George Lucas, Benicio Del Toro; Mark Hamill; Oscar Isaac
001486, Kill Me Three Times, 2014, Kriv Stenders, James McFarland, Simon Pegg; Teresa Palmer; Alice Braga
001487, Porno, , Danny Boyle, Irvine Welsh; John Hodge, Ewan McGregor; Robert Carlyle; Jonny Lee Miller
001488, National Treasure, 2004, Jon Turteltaub, Jim Kouf; Cormac Wibberley, Nicolas Cage; Diane Kruger; Justin Bartha
001489, There's Something About Mary, 1998, Bobby Farrelly; Peter Farrelly, Ed Decter; John J. Strauss, Ben Stiller; Cameron Diaz; Matt Dillon
001490, The Waterboy, 1998, Frank Coraci, Tim Herlihy; Adam Sandler, Adam Sandler; Kathy Bates; Henry Winkler
001491, Unexpected, 2015, Kris Swanberg, Megan Mercier; Kris Swanberg, Cobie Smulders; Anders Holm; Gail Bean
001492, Casper, 1995, Brad Silberling, Joseph Oriolo; Sherri Stoner, Bill Pullman; Christina Ricci; Cathy Moriarty
001493, The Towering Inferno, 1974, John Guillermin, Richard Martin Stern; Thomas N. Scortia, Paul Newman; Steve McQueen; William Holden
001494, Chicago, 2002, Rob Marshall, Bill Condon; Bob Fosse, Renée Zellweger; Catherine Zeta-Jones; Richard Gere
001495, House of 1000 Corpses, 2003, Rob Zombie, Rob Zombie, Sid Haig; Karen Black; Bill Moseley
001496, The Skeleton Twins, 2014, Craig Johnson, Craig Johnson; Mark Heyman, Kristen Wiig; Bill Hader; Luke Wilson
001497, How the Grinch Stole Christmas, 2000, Ron Howard, Dr. Seuss; Jeffrey Price, Jim Carrey; Taylor Momsen; Kelley
001498, That's My Boy, 2012, Sean Anders, David Caspe, Adam Sandler; Andy Samberg; Leighton Meester
001500, Rio, 2011, Carlos Saldanha, Carlos Saldanha; Earl Richey Jones, Jesse Eisenberg; Anne Hathaway; George Lopez
001501, Crash, 1996, David Cronenberg, J.G. Ballard; David Cronenberg, James Spader; Holly Hunter; Elias Koteas
001502, Leap Year, 2010, Anand Tucker, Deborah Kaplan; Harry Elfont, Amy Adams; Matthew Goode; Adam Scott
001503, The Crucible, 1996, Nicholas Hytner, Arthur Miller; Arthur Miller, Daniel Day-Lewis; Winona Ryder; Paul Scofield
001504, Bicentennial Man, 1999, Chris Columbus, Isaac Asimov; Isaac Asimov, Robin Williams; Embeth Davidtz; Sam Neill
001505, Event Horizon, 1997, Paul W.S. Anderson, Philip Eisner, Laurence Fishburne; Sam Neill; Kathleen Quinlan
001506, Garden State, 2004, Zach Braff, Zach Braff, Zach Braff; Peter Sarsgaard; Natalie Portman
001507, Young Adult, 2011, Jason Reitman, Diablo Cody, Charlize Theron; Patrick Wilson; Patton Oswalt
001508, Natural Born Killers, 1994, Oliver Stone, Quentin Tarantino; David Veloz, Woody Harrelson; Juliette Lewis; Tom Sizemore
001509, American Pie 2, 2001, J.B. Rogers, Adam Herz; David H. Steinberg, Jason Biggs; Seann William Scott; Shannon Elizabeth
001510, Megamind, 2010, Tom McGrath, Alan Schoolcraft; Brent Simons, Will Ferrell; Jonah Hill; Brad Pitt
001511, The Thin Red Line, 1998, Terrence Malick, James Jones; Terrence Malick, Jim Caviezel; Sean Penn; Nick Nolte
001512, Westworld, 1973, Michael Crichton, Michael Crichton, Yul Brynner; Richard Benjamin; James Brolin
001513, Blue Jasmine, 2013, Woody Allen, Woody Allen, Cate Blanchett; Alec Baldwin; Peter Sarsgaard
001514, Clown, 2014, Jon Watts, Christopher D. Ford; Jon Watts, Eli Roth; Peter Stormare; Laura Allen
001515, London Fields, 2015, Mathew Cullen, Martin Amis; Roberta Hanley, Jaimie Alexander; Cara Delevingne; Amber Heard
001516, Rear Window, 1954, Alfred Hitchcock, John Michael Hayes; Cornell Woolrich, James Stewart; Grace Kelly; Wendell Corey
001517, It's Complicated, 2009, Nancy Meyers, Nancy Meyers, Meryl Streep; Steve Martin; Alec Baldwin
001518, Atlantis: The Lost Empire, 2001, Gary Trousdale; Kirk Wise, Tab Murphy; Kirk Wise, Michael J. Fox; Jim Varney; Corey Burton
001519, Defiance(I), 2008, Edward Zwick, Clayton Frohman; Edward Zwick, Daniel Craig; Liev Schreiber; Jamie Bell
001520, On Her Majesty's Secret Service, 1969, Peter R. Hunt, Simon Raven; Richard Maibaum, George Lazenby; Diana Rigg; Telly Savalas
001521, Dances with Wolves, 1990, Kevin Costner, Michael Blake; Michael Blake, Kevin Costner; Mary McDonnell; Graham Greene
001522, Texas Chainsaw 3D, 2013, John Luessenhop, Adam Marcus; Debra Sullivan, Alexandra Daddario; Tania Raymonde; Scott Eastwood
001523, Draft Day(I), 2014, Ivan Reitman, Scott Rothman; Rajiv Joseph, Kevin Costner; Chadwick Boseman; Jennifer Garner
001524, Jenny's Wedding, 2015, Mary Agnes Donoghue, Mary Agnes Donoghue, Katherine Heigl; Tom Wilkinson; Linda Emond
001525, Midnight's Children, 2012, Deepa Mehta, Salman Rushdie; Deepa Mehta, Rajat Kapoor; Vansh Bhardwaj; Anupam Kher
001526, Mirror Mirror(I), 2012, Tarsem Singh, Marc Klein; Jason Keller, Lily Collins; Julia Roberts; Armie Hammer
001527, Vicky Cristina Barcelona, 2008, Woody Allen, Woody Allen, Rebecca Hall; Scarlett Johansson; Javier Bardem
001528, The Day the Earth Stood Still, 2008, Scott Derrickson, David Scarpa; Edmund H. North, Keanu Reeves; Jennifer Connelly; Kathy Bates
001529, The Three Musketeers, 2011, Paul W.S. Anderson, Alex Litvak; Andrew Davies, Logan Lerman; Matthew Macfadyen; Ray Stevenson
001530, Maid in Manhattan, 2002, Wayne Wang, John Hughes; Kevin Wade, Jennifer Lopez; Ralph Fiennes; Natasha Richardson
001531, Elite Squad: The Enemy Within, 2010, José Padilha, Bráulio Mantovani; Bráulio Mantovani, Wagner Moura; Irandhir Santos; André Ramiro
001532, Pocahontas, 1995, Mike Gabriel; Eric Goldberg, Carl Binder; Susannah Grant, Mel Gibson; Linda Hunt; Christian Bale
001533, Last Vegas, 2013, Jon Turteltaub, Dan Fogelman, Robert De Niro; Michael Douglas; Morgan Freeman
001534, Mystery Road, 2013, Ivan Sen, Ivan Sen, Aaron Pedersen; Hugo Weaving; Ryan Kwanten
001535, Contes immoraux, 1974, Walerian Borowczyk, Walerian Borowczyk; André Pieyre de Mandiargues, Lise Danvers; Fabrice Luchini; Charlotte Alexandra
001536, The Emperor's New Groove, 2000, Mark Dindal, Chris Williams; Mark Dindal, David Spade; John Goodman; Eartha Kitt
001537, Forgetting Sarah Marshall, 2008, Nicholas Stoller, Jason Segel, Kristen Bell; Jason Segel; Paul Rudd
001538, Old School, 2003, Todd Phillips, Court Crandall; Todd Phillips, Luke Wilson; Vince Vaughn; Will Ferrell
001539, Black Panther, 2018, F. Gary Gray, Joe Robert Cole; Jack Kirby, Andy Serkis; Chadwick Boseman
001540, The Twilight Saga: New Moon, 2009, Chris Weitz, Melissa Rosenberg; Stephenie Meyer, Kristen Stewart; Robert Pattinson; Taylor Lautner
001541, Walk of Shame, 2014, Steven Brill, Steven Brill, Elizabeth Banks; James Marsden; Gillian Jacobs
001542, Dear John(I), 2010, Lasse Hallström, Jamie Linden; Nicholas Sparks, Channing Tatum; Amanda Seyfried; Richard Jenkins
